Code,Description,URL
E1264,"Get that Oh so adorable look in this dress by Milano Formals E1264. This lovely cocktail dress is on a strapless semi sweetheart neckline over upper bodice of intricately vertical pleats. A brooch like embellishment at the center adds spark as you dance away through the above the knee-length sheer layers of chiffon flaring skirt. This Milano Formal dress will definitely make you feel special! Style: milano_E1264 Closure: Corset Details: Strapless, Chiffon, A line, Corset back closure Fabric: Chiffon Length: Short Neckline: Semi-sweetheart Waistline: Natural Silhouette: A Line Category: Bridesmaid Available Colors: Black, Red, Orange, Green, Purple, Brown Sizes: 00Â– 30 This special occasion dress is returnable. Please refer to our special occasion dress return policy (click here) for more details..",https://www.lookmazing.com/milano-formals-strapless-sweetheart-pleated-bodice-short-dress-e1264/products/15828834
B8331,Milano Formals - B8331 Bridesmaid Dress Fabric : Chiffon Closure : Zipper This special occasion dress is returnable. Please refer to our special occasion dress return policy (click here) for more details..,https://www.lookmazing.com/milano-formals-b8331-bridesmaid-dress/products/17242424
E1386,"Elegantly styled cocktail length dress done with layers of pleaded at the bottom and a sash under the bodice Color : Lilac, Plum, Pool Size : 4-28 This special occasion dress is returnable. Please refer to our special occasion dress return policy (click here) for more details..",https://www.lookmazing.com/milano-formals-e1386-bridesmaid-dress/products/17242428
E1285,"Walk in style and elegance in Milano Formals E1285. This glossy satin cocktail dress features a soft semi-sweetheart neckline and ribbon trimmed wide pleated waistband accent, elegantly trims the waist. The graceful A-line silhouette of this charmingly lovable short dress flatters any figure. Go and enjoy the fun, be gorgeous and youthful in this dress by Milano Formals. Style: milano_E1285 Closure: Corset Details: Strapless, Pleated waistband, Glossy satin fabric Fabric: Satin Length: Cocktail Neckline: Semi-sweetheart Waistline: Natural Silhouette: A Line Category: Bridesmaid Available Colors: Brown, Purple, Pink, Gold Sizes: 00Â– 30 This special occasion dress is returnable. Please refer to our special occasion dress return policy (click here) for more details..",https://www.lookmazing.com/milano-formals-ribbon-applique-semi-sweetheart-satin-dress-e1285/products/15828858
,"Enter the hall and let all eyes set on you in this Milano F570. This Bridesmaid Chiffon long gown features a plunging scoop neckline and fine spaghetti strap extending to the mid open back adorned by draping ribbon tail. Look fabulous for your formal event in this eccentric design from Milano Formals Style: milano_F570 Closure: Zipper Details: Plunging straight neckline, Spaghetti strap, Back zip up closure, Mid open back Fabric: Chiffon Length: Long Neckline: Straight Across Waistline: Natural Silhouette: Sheath Category: Bridesmaid Available Colors: Purple, Blue, Pink, Red, White, Black, Green Sizes: 00Â– 30 This special occasion dress is returnable. Please refer to our special occasion dress return policy (click here) for more details..",https://www.lookmazing.com/milano-formals-spaghetti-strap-chiffon-long-gown-f570/products/15828823
E1573,"Be the darling of the party and show off your sweet side in Milano Formals 1573. The bodice is crafted with layers of fine laid-over pleats on a semi sweetheart bustline and a well defined waistline highlighted by a sash with a rhinestone brooch at the center. The elegantly layered mini-skirt creates a flaring sheer hemline. A Milano Formals perfect for that dream girl! Style: milano_E1573 Closure: Zipper Details: Strapless, Sweetheart neck line, Pleated bodice, Rhinestone brooch embellishment Fabric: Chiffon Length: Short Neckline: Semi-sweetheart Waistline: Natural Silhouette: A Line Category: Bridesmaid Available Colors: Pink, Purple, Black Sizes: 00Â– 30 This special occasion dress is returnable. Please refer to our special occasion dress return policy (click here) for more details..",https://www.lookmazing.com/milano-formals-strapless-sweetheart-neckline-pleated-chiffon-cocktail-dress-e1573/products/15828876
,"Shine with glamour in a graceful dress from Milano Formals E1463. Crafted in lustrous taffeta fabric this gorgeous dress done in sleeveless style and a V-neck neckline is sure to flatter your figure. Highlighting the waist is wide finely ruched waistband with floral embellishment on one side. The graceful A-line silhouette skirt has added a pinch of playfulness. Be the darling, creates a fun and exciting look in Milano Formals. Style: milano_E1463 Closure: Zipper Details: Glossy Taffeta fabric, V neckline, Sleeveless, Waistband with floral applique, Zip up closure Fabric: Taffeta Length: Cocktail Neckline: V Neckline Waistline: Natural Silhouette: A Line Category: Bridesmaid Available Colors: Orange, Green, Brown Sizes: 00Â– 30 This special occasion dress is returnable. Please refer to our special occasion dress return policy (click here) for more details..",https://www.lookmazing.com/milano-formals-sleeveless-v-neckline-ruched-waist-taffeta-cocktail-dress/products/15828865
B8808,"Make everyone`s jaws drop as you enter that opulent ballroom wearing this classic Milano Formals B8808 creation. Elaborately festooned with bejeweled embroidered detail on its bodice, this charming piece presents a strapless straight-across neckline with ornate contrast trims traversing to the lace up detailed back. Exquisitely sculpted to accentuate the female form, this ensemble flaunts a pronounced full-length A-line skirt. Floral ornaments adorn the back panel as it completes with a subtle train. Fulfill your fantasies of an idyllic night of romance wearing this Milano Formals masterpiece. Models are wearing the Black, Ivory and Red colors. Style: milano_B8808 Category: Wedding Dresses Details: Strapless, Seams, Embroidery, Beaded, Contrast Back Panel, Lace Up Details, Mid-Open Back, Sweep Train Length: Long Neckline: Strapless Straight-Across Waistline: Natural Silhouette: A-Line This special occasion dress is returnable. Please refer to our special occasion dress return policy (click here) for more details..",https://www.lookmazing.com/milano-formals-b8808-strapless-embroidered-a-line-gown/products/18366059
E1381,Strapless sweetheart neckline with ruched pattern bodice accented with a center flower detail embroidery and comes with a mid thigh level skirt. Color : Purple Size : 4-24 Closure : Zipper This special occasion dress is returnable. Please refer to our special occasion dress return policy (click here) for more details..,https://www.lookmazing.com/milano-formals-e1381-prom-dress/products/15679293
E1531,"Promote attention-grabbing style in this stunning Milano Formals E1531. The well-defined sweetheart neckline is set up perfectly on the finely ruched bodice and floor length flowing skirt, accented by a midsection jeweled applique on one side. This simple and yet elegant creation from Milano Formals is a sure showstopper! Style: milano_E1531 Closure: Zipper Details: Sleeveless, Sweetheart neckline, Rushed bodice, Jeweled applique waist, Floor length Fabric: Chiffon Length: Long Dress Neckline: Sweetheart Waistline: Natural Silhouette: A Line Category: Bridesmaid Available Colors: Pink, Purple, Blue Sizes: 00Â– 30 This special occasion dress is returnable. Please refer to our special occasion dress return policy (click here) for more details..",https://www.lookmazing.com/milano-formals-strapless-sweetheart-ruched-chiffon-dress-e1531/products/15828870
E1347,"Flatter your figure with this eccentric design by Milano Formals E1347 cocktail dress. The fitted surplice bodice is styled up by pleats that fan out over the sweetheart neckline. The curve-hugging dress also features pleats along the midriff and across the short skirt, which also boasts a glittering starburst embellishment. This Milano Formals ensemble positively crackles with excitement! Style: milano_E1347 Details: Strapless, Beaded waistband, Empire, Chiffon skirt, Lace up back closure Length: Short Neckline: Sweetheart Waistline: Natural Silhouette: Sheath This special occasion dress is returnable. Please refer to our special occasion dress return policy (click here) for more details..",https://www.lookmazing.com/milano-formals-e1347-strapless-pleated-starburst-short-dress/products/18366064
E1657,"Render everyone speechless as they see you fabulously walking in Milano Formals E1657. Time to flaunt those beautiful shoulders through the strapless sweetheart neckline of this gorgeous long dress. The detailed fine ruching that created a twist at the center bodice is complemented by the fully beaded waistband. The A-line draping skirt glides perfectly to the floor into a wide hemline. This Milano Formals is breathtakingly beautiful. Perfect on your next formal event. Style: milano_E1657 Closure: Zipper Details: Strapless, Sweetheart, Twisted Rushed bodice, Flared Fabric: Chiffon Length: long Neckline: Sweetheart Waistline: Natural Silhouette: A Line Category: Bridesmaid Available Colors: Purple, Green, Black Sizes: 00Â– 30 This special occasion dress is returnable. Please refer to our special occasion dress return policy (click here) for more details..",https://www.lookmazing.com/milano-formals-strapless-sweetheart-neckline-twisted-ruched-body-long-dress-e1657/products/15828886
E1342,Milano Formals - E1342 Prom Dress Color : Fuschia Size : 0-22 This special occasion dress is returnable. Please refer to our special occasion dress return policy (click here) for more details..,https://www.lookmazing.com/milano-formals-e1342-prom-dress/products/15679298
E1693,"Glamour gets gorgeous with this cocktail dress by Milano Formals E1693. The chic bateau neckline tenderly connects to glossy long sleeves. An arching motif from sequin embellishment creates a two-tone display among the sheath design. The mini-skirt hem flashes with an allover pattern. This design by Milano Formals is a win on so many levels! Style: milano_E1693 Details: Long sleeves, Sequined, Fitted dress Length: Short Neckline: Bateau Waistline: Natural Silhouette: Sheath This special occasion dress is returnable. Please refer to our special occasion dress return policy (click here) for more details..",https://www.lookmazing.com/milano-formals-e1693-long-sleeved-sequined-cocktail-dress/products/18941773
AA222,"Look like a siren in a melodic gown Milano Formals AA222. This elegant chiffon dress features an off the shoulder neckline accented with a brooch at the side. The waist is cinched in a wide waistband and has a zipper closure on its bodice. From the natural waist begins a full length A-line skirt and finishes in a sweep train. You`re statuesque in a posed gown from Milano Formals. Model is wearing Ivory color. Style: milano_AA222 Category: Wedding Dresses Details: Off-shoulder sleeves, Wide waistband, A-line skirt, Brooch, Sweep train Length: Long Neckline: Off-Shoulder Waistline: Natural Silhouette: A-line This special occasion dress is returnable. Please refer to our special occasion dress return policy (click here) for more details.",https://www.lookmazing.com/milano-formals-aa222-off-shoulder-chiffon-a-line-wedding-gown/products/19528327
AA221,"Feel gorgeous in this fabulous wedding gown by Milano Formals AA221. A straight across neckline supported with one shoulder strap adorned with ornate rosettes top the ruched empire bodice. The bodice has gentle ruching and the a-line skirt has a subtle sweep with sheer overlay. This gown is full length with a mid-open back enclosed with a center zipper closure. Display your natural beauty and grace with this Milano Formals masterpiece. Model is wearing White color. Style: milano_AA221 Category: Wedding Dresses Details: Sleeveless, One Shoulder Rosette Strap, Ruched Bodice, Gathered Skirt, Floor Length, Mid-Open Back, Back Zipper Closure Length: Long Neckline: Straight Across Waistline: Empire Silhouette: A-Line This special occasion dress is returnable. Please refer to our special occasion dress return policy (click here) for more details.",https://www.lookmazing.com/milano-formals-aa221-rosette-one-shoulder-strap-ruched-dress/products/19528314
AA219,"Lovely simplicity makes this gown by Milano Formals AA219. Graces in a strapless, straight across neckline with bust styled in ruching. This chiffon gown is cinched at the waist in wrap and flourishes towards the floor in an A-line silhouette and finishes in a sweep train. This classy gown from Milano Formals is great for your wedding. Model is wearing White color. Style: milano_AA219 Category: Wedding Dresses Details: Strapless, Ruched bodice, Wrap style waist, A-line skirt, Sweep train Length: Long Neckline: Straight Waistline: Empire Silhouette: A-line This special occasion dress is returnable. Please refer to our special occasion dress return policy (click here) for more details.",https://www.lookmazing.com/milano-formals-aa219-strapless-straight-across-chiffon-wedding-gown/products/19528324
E1472,Milano Formals - E1472 Short Dress Color: Purple Size : 4-24 This special occasion dress is returnable. Please refer to our special occasion dress return policy (click here) for more details..,https://www.lookmazing.com/milano-formals-e1472-short-dress/products/15695024
E1341,Milano Formals - E1341 Prom Dress Color : Yellow Size : 0-28 Closure : Corset This special occasion dress is returnable. Please refer to our special occasion dress return policy (click here) for more details..,https://www.lookmazing.com/milano-formals-e1341-prom-dress/products/15679304
E2086,"Enter the hall with grace and beauty in this dress by Milano Formals E2086. This sleeves dress is designed with a high neckline ruched bodice framed with a chic belt and a centered bow. The skirt finishes in a full length hem. This Milano Formals dress is an ageless look fit for any formal event. Style: milano_E2086 Closure: Zipper Details: Sleeveless, Ruched top, Chic belt with mid-bow Fabric: Chiffon Length: Long Neckline: High Waistline: Natural Silhouette: Sheath Category: Long Dress Available Colors: Red Sizes: 00 Â– 30 This special occasion dress is returnable. Please refer to our special occasion dress return policy (click here) for more details..",https://www.lookmazing.com/milano-formals-sleeveless-high-neck-ruched-bodice-long-dress-e2086/products/15828982
E2083,"Feel like a dainty belle in this Milano Formals E2083 long evening gown. This beautiful piece has a V-shaped neckline and open back that complements its delicate lace bodice. A chic bow detail on the waistband cinches the flowy chiffon skirt of this beauty. Be effortlessly feminine with this Milano Formals evening gown. Style: milano_E2083 Closure: Zipper Details: V-Shaped Neckline, V-Shaped Open Back, Bow Waistband Detail, Cinched Skirt, Floor Length Hem, Lace Bodice Fabric: Lace/Chiffon Length: Long Neckline: V-Neck Waistline: Natural Silhouette: Sheath Category: Long Dress Available Colors: Pink Sizes: 00 Â– 18 This special occasion dress is returnable. Please refer to our special occasion dress return policy (click here) for more details..",https://www.lookmazing.com/milano-formals-chic-bow-evening-gown-dress-e2083/products/15829141
E2079,"Create a sophisticated persona with this Milano Formals E2079 long crimson gown. This ravishing attire has a bateau illusion neckline and beautiful drape details cinching the waist in the right places. A net insert is carefully incorporated with its back design to both provide allure and support. This garment finishes off its flattering sheath silhouette with a train of soft fabric. Be a sure stunner with this Milano Formals evening gown. Style: milano_E2079 Closure: Zipper Details: Bateau Illusion Neckline, Lace Mesh, Draped Sheath Silhouette, Netted Open Back, Floor Length Train Fabric: Stretch Satin Length: Long Neckline: Bateau Illusion Waistline: Natural Silhouette: Sheath Category: Long Dress Available Colors: Red Sizes: 00 Â– 18 This special occasion dress is returnable. Please refer to our special occasion dress return policy (click here) for more details..",https://www.lookmazing.com/milano-formals-lace-illusion-evening-dress-e2079/products/15829127
E1322,Milano Formals - E1322 Prom Dress Color : Purple Size : 4-20 This special occasion dress is returnable. Please refer to our special occasion dress return policy (click here) for more details..,https://www.lookmazing.com/milano-formals-e1322-prom-dress/products/15695054
E2085,"Flaunt your assets with this vintage-cut Milano Formals E2085 long evening gown. Show your shapely shoulders with its flattering sweetheart neckline. Its exquisite lace bodice and open back add a touch of romance to its fitted floor length skirt. To complete the whole look, accentuating the waist is a band topped by a chic. Love the body you are in with this classy Milano Formals gown. Style: milano_E2085 Closure: Zipper Details: Sweetheart Neckline, Sheath Silhouette, Lace Bodice, Bow Detail of Waistband, Floor Length Hem, Open Back Fabric: Jersey Length: Long Neckline: Sweetheart Waistline: Natural Silhouette: Sheath Category: Long Dress Available Colors: Gray Sizes: 00 Â– 18 This special occasion dress is returnable. Please refer to our special occasion dress return policy (click here) for more details..",https://www.lookmazing.com/milano-formals-lace-sweetheart-long-evening-gown-e2085/products/15829145
E1382,Beautifully Tiered Orange Cocktail Dress in strapless straight neckline paired with contrasting black waistband to accent the ruffle ties bodice. Color : Orange Size : 4-28 Closure : Zipper This special occasion dress is returnable. Please refer to our special occasion dress return policy (click here) for more details..,https://www.lookmazing.com/milano-formals-e1382-prom-dress/products/15695014
E1344,Milano Formals - E1344 Prom Dress Color : Yellow Size : 2-18 This special occasion dress is returnable. Please refer to our special occasion dress return policy (click here) for more details..,https://www.lookmazing.com/milano-formals-e1344-prom-dress/products/15679308
E2053,"Dress to impress on your next formal event in this simple but captivating dress by Milano Formals E2053. This dress parades in a sleeveless scooped neckline overlaid by lace embellishments that spreads to the cutouts at the back. The dress is framed with a band where the A-line skirt flourishes to the floor. This Milano Formals dress is sure to give the classic vibe that works for many special occasions. Style: milano_e2053 Closure: Zipper Details: Sleeveless, Lace Embellishment, Cutouts at the back Fabric: Lace/Chiffon Length: Long Neckline: Scoop Waistline: Natural Silhouette: A-Line Category: Long Dress Available Colors: Green Sizes: *00 Â– 30 This special occasion dress is returnable. Please refer to our special occasion dress return policy (click here) for more details..",https://www.lookmazing.com/milano-formals-sleeveless-lace-embellished-scoop-neck-long-a-line-dress-e2053/products/15828915
E1396,Milano Formals - E1396 Prom Dress Color : Purple Size : 0-20 This special occasion dress is returnable. Please refer to our special occasion dress return policy (click here) for more details..,https://www.lookmazing.com/milano-formals-e1396-prom-dress/products/15679309
E1327,Milano Formals - E1327 Prom Dress Color : Black Size : 4-16 This special occasion dress is returnable. Please refer to our special occasion dress return policy (click here) for more details..,https://www.lookmazing.com/milano-formals-e1327-prom-dress/products/15695078
E2082,"Embody a Grecian goddess with this Milano Formals E2082 evening gown. This astounding number features a simple yet classy high halter neckline and a closed back. The subtle pleating found all throughout this creation gives the illusion of proportion and length to any body type. Its sheath silhouette ends with a sweep of soft train. Make a lasting statement with this captivating Milano Formals evening gown. Style: milano_E2082 Closure: Zipper Details: Halter Pleated Neckline, Thick Fluted Waistband, Cinched Waist, Floor Length Train, Closed Back Fabric: Stretch Satin Length: Long Neckline: Halter Waistline: Natural Silhouette: Sheath Category: Long Dress Available Colors: Black Sizes: 00 Â– 18 This special occasion dress is returnable. Please refer to our special occasion dress return policy (click here) for more details..",https://www.lookmazing.com/milano-formals-black-halter-evening-gown-dress-e2082/products/15829137
E1448,"Baby Doll cocktail dress in mini-sweetheart neckline to accentuate that butterfly embellishment design. Color: Black, Purple Size : 4-24 Closure : Corset This special occasion dress is returnable. Please refer to our special occasion dress return policy (click here) for more details..",https://www.lookmazing.com/milano-formals-e1448-prom-dress/products/15679290
E1333,Milano Formals - E1333 Prom Dress Color : Teal Size : 4-16 This special occasion dress is returnable. Please refer to our special occasion dress return policy (click here) for more details..,https://www.lookmazing.com/milano-formals-e1333-prom-dress/products/15695066
E2087,"Show off your feminine side with this long dress by Milano Formals E2087. Showcases a sleeveless lace sequined illusion bodice over a sweetheart liner that is framed by a chic belt with a rosette on the side. The suave skirt finishes with a full length hem. This Milano Formals dress will let you celebrate that divine feminine beauty! Style: milano_E2087 Closure: Zipper Details: Sleeveless, Sweetheart liner, Illusion bodice, Lace embroidery, Chic belt with a rosette, Ruched skirt Fabric: Chiffon Length: Long Neckline: Bateau Waistline: Natural Silhouette: A-Line Category: Long Dress Available Colors: Pink Sizes: 00 Â– 30 This special occasion dress is returnable. Please refer to our special occasion dress return policy (click here) for more details..",https://www.lookmazing.com/milano-formals-sleeveless-bateau-neck-laced-embellished-bodice-long-dress-e2087/products/15828986
E2044,"Look chic and seductive in this marvelous dress by Milano Formals E2044. This sleek dress parades in a deep v-neckline with sheer fabric in the middle. The form fitting skirt with princess seams graciously flares towards the floor with a side thigh-high slit. This Milano Formals dress is a sure standout on your next evening social event. Style: milano_E2044 Closure: Zipper Details: Sheer fabric, Thigh-high slit, Princess seams, Open back Fabric: Stretch Satin Length: Long Neckline: V-Neckline Waistline: Natural Silhouette: Fit and Flare Category: Long Dress Available Colors: Black Sizes: 00 Â– 18 This special occasion dress is returnable. Please refer to our special occasion dress return policy (click here) for more details..",https://www.lookmazing.com/milano-formals-v-neck-fit-and-flare-long-dress-with-side-thigh-high-slit-e2044/products/15828945
B8759,Milano Formals - B8759 Prom Dress Color : Gold Size : 4-20 Fabric : Chiffon Closure : Zipper This special occasion dress is returnable. Please refer to our special occasion dress return policy (click here) for more details..,https://www.lookmazing.com/milano-formals-b8759-prom-dress/products/15695084
B8594,Milano Formals - B8594 Prom Dress Color : Orange Size : 0-14 Fabric : Net Closure : Zipper This special occasion dress is returnable. Please refer to our special occasion dress return policy (click here) for more details..,https://www.lookmazing.com/milano-formals-b8594-prom-dress/products/15695096
E1663,"Dress to impress on your next formal event in Milano Formals E1663. This short cocktail party dress in V neckline features a wrapped over design creating ruched effect on the bodice. Highlighted by a sparkling brooch is a waistband to define the midsection. Tiered of ruffles are nicely set at one side of the elegant mid-thigh flaring skirt. This is definitely an all occasion dress that will let you stand out from the rest, by Milano formals. Style: milano_E1663 Closure: Zipper Details: Sleeveless, V-Neckline, Waistband accented, Brooch embellishment, Flare skirt Fabric: Chiffon Length: Short Neckline: V Neckline Waistline: Natural Silhouette: A Line Category: Bridesmaid Available Colors: Purple, Pink, Blue Sizes: 00Â– 30 This special occasion dress is returnable. Please refer to our special occasion dress return policy (click here) for more details..",https://www.lookmazing.com/milano-formals-sleeveless-v-neckline-wrap-mini-dress-with-ruffles-e1663/products/15828888
E1168,"Elegance tied beautifully as defined by Milano E1168! With a stylish halter straps tie around your neck, this regal long gown features a semi-sweetheart neckline in fine shirred fitting bodice and satin waistband . The floor length shirred skirt cascades down to create a beautifully flowing full skirt. This Milano Formal is completely gorgeous! Style: milano_E1168 Closure: Zipper Details: Sleeveless, Halter straps, Shirred, Chiffon over satin, Back zip up closure Fabric: Chiffon Length: Long Dress Neckline: Semi-sweetheart Waistline: Natural Silhouette: A Line Category: Bridesmaid Available Colors: Blue, Green, Purple, Red Sizes: 00Â– 30 This special occasion dress is returnable. Please refer to our special occasion dress return policy (click here) for more details..",https://www.lookmazing.com/milano-formals-halter-straps-shirred-long-gown-e1168/products/15828846
