Code,Description,URL
E2182,"Defy the predictable with this figure accentuating Milano Formals 2182 evening dress. This piece is highlighted by a bateau illusion neckline, trimmed waistband and an elaborately sewn beadwork overlaying its fitted bodice. The back features a deep teardrop opening lined with sparkling beads. A flowy chiffon skirt finishes the look by emphasizing the waist and cascading down into a sweep of train. Have an excuse to wear that sassy pair of stilettoes with this Milano Formals evening dress. Always be ready for your close up with this Milano Formals evening gown. Style: milano_E2182 Closure: Zipper Details: Bateau Illusion Neckline, Beaded Lace Mesh, Full Chiffon A-Line Skirt, Circular Open Back Fabric: Net Length: Long Neckline: Bateau Illusion Waistline: Natural Silhouette: A-Line Category: Ball Gown Available Colors: Blue Sizes: 00 Â– 18 This special occasion dress is returnable. Please refer to our special occasion dress return policy (click here) for more details..",https://www.lookmazing.com/milano-formals-embellished-cap-sleeved-evening-gown-e2182/products/15855722
E2060,"Make your presence known with this elegant bedazzled Milano Formals E2060 piece. This alluring gown features a halter top neckline speckled with meticulously woven geometric beads on a skin-tone bodice. Midriff cutouts are immaculately displayed on the gown to add a flirty feel to the overall look. The beaded waistband wraps around the its silhouette as it flawlessly transitions into the sexy open back. Cease from sharing the spotlight with this Milano Formals beaded gown. Style: milano_E2060 Closure: Zipper Details: High Halter Neckline, Waist and Hips Cut-out Details, Beaded Waistband, Sheath Silhouette, Intricate Beadwork on Skin-toned Bodice, Low Open Back Fabric: Stretch Satin Length: Long Neckline: Halter Waistline: Natural Silhouette: Sheath Category: Long Dress Available Colors: Blue Sizes: 00 Â– 18 This special occasion dress is returnable. Please refer to our special occasion dress return policy (click here) for more details..",https://www.lookmazing.com/milano-formals-contrast-beading-satin-evening-gown-e2060/products/15829083
E1979,"Appear in elegance with this figure-hugging Milano Formals E1979 jersey gown. This halter gown with low open back is adorned with beads that adds glitziness. Bead works are heavier on the waist area creating an illusion belt. The fitted skirt cascading smoothly to a sweep train gives an extra taste of sophistication to this master piece. This Milano Formals creation is truly a definition of glamour. Style: milano_E1979 Closure: Zipper Details: Low Back, Beaded Bodice, Beaded Waist Line, Sweep Train Fabric: Jersey Length: Long Neckline: Halter Waistline: Natural Silhouette: Trumpet Category: Long Dress Available Colors: Blue Sizes: 00 Â– 18 This special occasion dress is returnable. Please refer to our special occasion dress return policy (click here) for more details..",https://www.lookmazing.com/milano-formals-glistening-halter-jersey-gown-e1979/products/15860237
E2449,"Capture the intrigue of the upscale crowd in this stunningly designed Milano Formals E2449 creation. Sleekly tailored with seams on a sculpted bodice, this stunner showcases a deep v-neckline framed with ornate spaghetti straps. Crafted with a mid-open treatment, beaded straps crisscross along the back as the slender waistband mimics its sparkling iridescence. The ballgown skirt cascades in a full-length volume as beautiful blossoms ornate its sheer organza overlay. Dance all night long as you radiate style and poise in this impeccable Milano Formals masterpiece. Style: milano_E2449 Fabric: ORGANZA Closure: ZIPPER Details: Ornate Spaghetti Straps, Seams, Crisscrossed Open Back, Back Zipper Closure, Floral Organza., Embellished Slender Band, Full Length Hem Length: Long Neckline: Low V-Neck Waistline: Natural Silhouette: Ballgown This special occasion dress is returnable. Please refer to our special occasion dress return policy (click here) for more details..",https://www.lookmazing.com/milano-formals-e2449-sleek-v-neck-floral-organza-ballgown/products/18408177
E2110,"Look jaw dropping in this dramatic long dress by Milano Formals E2110. This dress features a deep v-neckline and bell sleeves overlaid by lace embellishments all throughout. The fitted bodice accentuates your curves and the full length skirt shows a gentle draped effect with a thigh-high slit. A sure winner from Milano Formals creation! Style: milano_E2110 Closure: Zipper Details: Deep V-neckline, Bell Sleeves, Lace overlay, Thigh-high slit Fabric: Jersey Length: Long Neckline: Deep V-Neckline Waistline: Natural Silhouette: Sheath Category: Long Dress Available Colors: Black Sizes: 00-18 This special occasion dress is returnable. Please refer to our special occasion dress return policy (click here) for more details..",https://www.lookmazing.com/milano-formals-bell-sleeves-deep-v-neck-sequined-long-dress-with-thigh-high-slit-e2110/products/15828992
E1984,"Be a spectacular belle on your next formal event in this Milano Formals E1984 mermaid gown. This black strapless dress features a sweetheart neckline and scattered beads on the bodice. A constellation of beads embellish the waistline creating an illusion belt accentuating your curve. The lace back makes it easy to adjust for a perfect fit and emphasize your natural form. The ruffled satin skirt completes the look. This Milano Formals is perfect for a girl who wants a standout style and flawless fit. Style: milano_E1984 Closure: Corset Details: Strapless, Embellished Bodice, Ruffled Skirt Fabric: Italian Satin Net Length: Long Neckline: Sweetheart Waistline: Natural Silhouette: Mermaid Category: Long Dress Available Colors: Black Sizes: 00 Â– 18 This special occasion dress is returnable. Please refer to our special occasion dress return policy (click here) for more details..",https://www.lookmazing.com/milano-formals-black-strapless-mermaid-gown-with-ruffled-skirt-e1984/products/15860248
E2341,"You will be the envy of the night in this amazing long prom dress with striking details by Milano Formals E2341. The crop top flaunts a sleeveless, square neckline with thin straps. The bodice is designed with striking floral prints and embellished with bead accents. The ballgown skirt runs in full length hem and is added with pockets. This design by Milano Formals is all set to make that evening your extra special! Style: milano_E2341 Fabric: Print Satin Closure: Zipper Details: Two piece, Sleeveless, Thin straps, Floral prints, Beading, Ballgown skirt, Pockets, Back zipper, Square back Length: Long Neckline: Square Waistline: Natural Silhouette: Ballgown This special occasion dress is returnable. Please refer to our special occasion dress return policy (click here) for more details..",https://www.lookmazing.com/milano-formals-e2341-beaded-floral-print-two-piece-gown/products/18418344
E2017,"Redefine romance with this ethereal Milano Formals lace creation. Lined with lace appliques on bodice for coverage, this stunner has a bateau illusion over sweetheart neckline and a sheer closed back. This romantic design features an eye-catching beadwork over its fitted bodice. The fit and flare skirt cascades flawlessly down a full-length hem. Wear your heart on your sleeves with this Milano Formals gown. Style: milano_E2017 Closure: Zipper Details: Bateau Illusion over Sweetheart Neckline, Lace Applique on Bodice, Fit and Flare Silhouette, Full Length Hem, Sheer Closed Back Fabric: Lace/Satin Length: Long Neckline: Bateau Illusion Waistline: Natural Silhouette: Fit and Flare Category: Long Dress Available Colors: Pink Sizes: 00 Â– 30 This special occasion dress is returnable. Please refer to our special occasion dress return policy (click here) for more details..",https://www.lookmazing.com/milano-formals-lace-appliqued-satin-evening-gown-e2017/products/15855689
E2096,"Capture hearts and attention every single time with this sparkling evening gown by Milano Formals E2096. Highlighting this majestic piece are the iridescent jewels lining up its waistband and cap sleeves. The buttery soft material of the bodice is artistically cinched at the waist and dips into a low v-shaped open back to accentuate any female form. The skirt falls down to the floor flawlessly to finish the stunning look. Gather fascinating glances with this Milano Formals long evening gown. Style: milano_E2096 Closure: Zipper Details: Bateau Neckline, Embellished Cap-Sleeved, Sheath Silhouette, Full Length Hem, Beaded Cinched Waistband, Subtly Pleated Skirt Detail, V-Shaped Low Open Back Fabric: Stretch Satin Length: Long Neckline: Bateau Waistline: Natural Silhouette: Sheath Category: Long Dress Available Colors: Black, White Sizes: 00 Â– 18 This special occasion dress is returnable. Please refer to our special occasion dress return policy (click here) for more details..",https://www.lookmazing.com/milano-formals-beaded-contrast-cap-sleeved-evening-gown-e2096/products/15855697
E1949,"Be the spotlight wearing this extravagant gown by Milano Formals E1949. The dress features a high neckline richly decorated in intricate beadwork that splays in the bodice and about the open back. The tulle skirt gives the gown a volume effect and drapes in a full length hem. This Milano Formals gown is a stunning look for your formal occasion. Style: milano_E1949 Closure: Zipper Details: Sleeveless, Beaded bodice, Tulle floor-length skirt, Open back with center closure Fabric: Net Length: Long Neckline: High Waistline: Natural Silhouette: Ball Gown Category: Ball Gown Available Colors: Purple Sizes: 00 Â– 18 This special occasion dress is returnable. Please refer to our special occasion dress return policy (click here) for more details..",https://www.lookmazing.com/milano-formals-sleeveless-high-neck-bedazzled-ball-gown-e1949/products/15855679
E2322,"Embrace a wonderful evening in this wondrous formal gown by Milano Formals E2322. This enchanting gown is designed with cap sleeves, and a scoop neckline. The bodice is embellished with glittering beads and sequins and has a zipper closure. Finishing the look is a floor length ballgown skirt for that princess-like effect. This Milano Formals gown is sure to be an attention-grabber in any occasion. Style: milano_E2322 Fabric: Net Closure: Zipper Details: Cap sleeves, Sheer, Sequins, Beading, Back zipper, Ballgown Length: Long Neckline: Scoop Waistline: Natural Silhouette: Ballgown This special occasion dress is returnable. Please refer to our special occasion dress return policy (click here) for more details..",https://www.lookmazing.com/milano-formals-e2322-bedazzled-scoop-neck-ballgown/products/18418337
E2116,"Show off your trendsetting style when you wear this dress by Milano Formals E2116. The dress features a sleeveless high neckline crop top with a keyhole opening in the front overlaid by multi-colored floral beadwork and a mid-open back. The smooth skirt is accentuated by a band of vibrant beadwork and tapers through the thighs and flares at the bottom for that figure flattering silhouette. This Milano Formals dress is sure to make a daring statement in that special affair! Style: milano_E2116 Closure: Zipper Details: Two piece dress, Sleeveless, Floral crop top with keyhole opening on the front, Mid-open back, Multi-colored floral beadwork, Flared skirt Fabric: Jersey Length: Long Neckline: High Waistline: Natural Silhouette: Fit and Flare Category: Long Dress Available Colors: White Sizes: 00 Â– 18 This special occasion dress is returnable. Please refer to our special occasion dress return policy (click here) for more details..",https://www.lookmazing.com/milano-formals-floral-beaded-high-neck-crop-top-with-keyhole-fit-and-flare-two-piece-long-dress-e2116/products/15828964
E2045,"Dress to impress on your next formal event in this simple but enchanting Milano Formals E2045. Gold sequined straps are sensibly beaded that work their way to the plunge neckline. Sexy slit will show off your legs while curve train adds grace. This Milano Gown will definitely charm you up in any social and evening party! Style: milano_E2045 Closure: Zipper Details: Scooped Neckline, Gold Beads, Criss-cross cutout Low Back, Thigh-high Slit Fabric: Stretch Satin Length: Long Neckline: V-Neckline Waistline: Natural Silhouette: Sheath Category: Long Dress Available Colors: Black Sizes: 00 Â– 18 This special occasion dress is returnable. Please refer to our special occasion dress return policy (click here) for more details..",https://www.lookmazing.com/milano-formals-gold-embroidered-evening-gown-e2045/products/15829067
E2095,"Radiate that bohemian princess feel with this Milano E2095 two-piece ensemble. Showcased in this attire is a halter crop top textured by beautifully interspersed beadwork and a racer back detail. Adorning its long flowy chiffon skirt is a beaded waistband that gathers the waist perfectly. Shine your brightest with this Milano Formals ensemble. Style: milano_E2095 Closure: Zipper Details: Beaded Bodice, Racer Back, Cropped Top, Beaded Waistband, Long Chiffon Flare Skirt, Floor Length Hem Fabric: Net Length: Long Neckline: Halter Waistline: Natural Silhouette: Flare Category: Long Dress Available Colors: Blue, White Sizes: 00 Â– 18 This special occasion dress is returnable. Please refer to our special occasion dress return policy (click here) for more details..",https://www.lookmazing.com/milano-formals-two-piece-textured-crop-top-evening-gown-e2095/products/15855696
E1940,"Render everyone speechless with this fabulous Milano Formals E1940 two-piece gown. Featuring a crop top gleaming with embellishments and an open back. A shining waistband trims the glossy skirt. This full-length design comes complete with dramatic shirring and a theatrical flare. This Milano Formals is perfect for a special occasion, wedding guest, or prom. Style: milano_E1940 Closure: Zipper Details: Two-Piece, Fully Beaded Sheer Crop Top, Cutout Open Back, Embellished Waistband, Flowy Skirt Fabric: Chiffon Length: Long Neckline: High Halter Illusion over Sweetheart Waistline: Natural Silhouette: A-Line Category: Long Dress Available Colors: Gray Sizes: 00 Â– 30 This special occasion dress is returnable. Please refer to our special occasion dress return policy (click here) for more details..",https://www.lookmazing.com/milano-formals-ravishing-two-piece-a-line-gown-e1940/products/15860214
E2097,"Be the spotlight wearing this extravagant dress by Milano Formals E2097. The two piece dress features a jewel neckline with sheer fabric and bedazzled crop top with the back highlighted with a keyhole opening. The full length skirt is accentuated by sparking bead work at the band and parades an A-line silhouette with layers of tulle fabric. This Milano Formals dress is sure to be an attention-grabber in any occasion. Style: milano_E2097 Closure: Zipper Details: Bedazzled Crop Top, Beadwork, Sheer fabric, Back with keyhole opening Fabric: Net Length: Long Neckline: Jewel Waistline: Natural Silhouette: A-Line Category: Ball Gown Available Colors: Blue, Green Sizes: 00 Â– 18 This special occasion dress is returnable. Please refer to our special occasion dress return policy (click here) for more details..",https://www.lookmazing.com/milano-formals-bedazzled-jewel-neck-two-piece-a-line-long-dress-e2097/products/15828957
E1980,"This enchanting Milano Formals E1985 evening gown is sure to make you the center of everyone's attention. Strapless, this dress has tonal beading throughout the fitted bodice. The bodice of the dress is adorned with breathtaking bead work. This Milano Formals will definitely grace you up in any social and evening party! Style: milano_E1985 Closure: Zipper Details: Strapless, Embellished Bodice, Silk Waistband Fabric: Taffeta Length: Long Neckline: Straight Across Waistline: Natural Silhouette: Trumpet Category: Long Dress Available Colors: Red Sizes: 00 Â– 18 This special occasion dress is returnable. Please refer to our special occasion dress return policy (click here) for more details..",https://www.lookmazing.com/milano-formals-scorching-red-trumpet-gown-e1980/products/15860250
E1882,No description found.,https://www.lookmazing.com/milano-formals-e1882-prom-dresses/products/15695048
E2009,"Glide like a luminous goddess on every runway with this Milano Formals E2009 evening gown. Showcasing a sheer bateau illusion over a sweetheart neckline, this ensemble displays a florid beadwork traversing its bodice, cap-sleeves and sheer open back. Highlighting the form is a sheer beaded midriff panel and the gilt-sewn waistband. The jersey full length skirt flows dramatically down the floor to finish the look. Get your own striking signature look with this Milano Formals gown. Style: milano_E2009 Closure: Zipper Details: Cap-sleeved, Jewel Illusion over Sweetheart Neckline, Intricate Beadwork on Bodice, Beaded Sheer Panel Detail, Beaded Waistband, Sheer Open Back, Thigh High Slit, Sheath Silhouette Fabric: Jersey Length: Long Neckline: Jewel Waistline: Natural Silhouette: Sheath Category: Long Dress Available Colors: White Sizes: 00 Â– 18 This special occasion dress is returnable. Please refer to our special occasion dress return policy (click here) for more details..",https://www.lookmazing.com/milano-formals-embellished-sheer-jersey-evening-gown-e2009/products/15855686
E1955,"Be the life of the party wearing this exquisite Milano Formals E1955 two-piece dress. Vibrant beading forms a halter neckline with a lengthy keyhole cutout at the back. The scallop pattern that wraps the bodice and the flowy white chiffon skirt is sure to stand out at any occasion. Complete this look by adding look earrings, a bracelet, and a clutch purse for all your personal belongings. This Milano Formals dress is sure to make you the darling of the night! Style: milano_E1955 Closure: Zipper Details: Two-Piece, Fully Beaded Sheer Crop Top, Keyhole Cutout Back, Embellished Waistband, Flowy Skirt Fabric: Chiffon Length: Long Neckline: High Neck Illusion over Sweetheart Waistline: Natural Silhouette: A-Line Category: Long Dress Available Colors: White, Green Sizes: 00 Â– 18 This special occasion dress is returnable. Please refer to our special occasion dress return policy (click here) for more details..",https://www.lookmazing.com/milano-formals-immaculate-two-piece-a-line-dress-e1955/products/15860218
E1965,"Look colorful and lively in this fabulous Milano Formals E1965 two-piece dress. A bateau neckline and a cutout open back flatters this sleeveless crop top covered with sparkling sequins atop illusion fabric. The matching sparkling waistband encircles the hips and trims the full-length design. Flowing chiffon material makes this dress ethereal. This Milano Formals will definitely grace you up in any social and evening party! Style: milano_E1965 Closure: Zipper Details: Two-Piece, Fully Beaded Sheer Crop Top, Cutout Open Back, Embellished Waistband, Flowy Skirt Fabric: Chiffon Length: Long Neckline: Bateau Illusion over Sweetheart Waistline: Natural Silhouette: A-Line Category: Long Dress Available Colors: Pink Sizes: 00 Â– 18 This special occasion dress is returnable. Please refer to our special occasion dress return policy (click here) for more details..",https://www.lookmazing.com/milano-formals-magnificent-two-piece-a-line-dress-e1965/products/15860220
E2057,"Be dainty, be flirty, be feminine with this Milano Formals E2057 Ball Gown. This phenomenal number features a florid but delicately executed floral bead design on its halter gossamer-like neckline. The combination of its sweetheart bodice, lace waistband and open keyhole back creates a fragile yet frilly kind of vibe to every feminine silhouette. Glide seamlessly with its soft flimsy skirt floats like a dream. Be exquisitely captivating from every angle with this Milano Formal ball gown. Style: milano_E2057 Closure: Zipper Details: High Halter Illusion Neckline over a Sweetheart Bodice, Intricate Beaded Floral Design, Open Keyhole Back, Gossamer-like Netted Skirt, Delicate Lace Waistband Fabric: Net Length: Long Neckline: Sweetheart Waistline: Natural Silhouette: A-Line Category: Ball Gown Available Colors: Pink Sizes: 00 Â– 18 This special occasion dress is returnable. Please refer to our special occasion dress return policy (click here) for more details..",https://www.lookmazing.com/milano-formals-embellished-sheer-a-line-ball-gown-e2057/products/15829078
E1929,"Be the lady of the night in this Milano Formals E1929 evening gown. This dress speaks lace and sheers from the neckline to the sleeve and down to the hem. The asymmetrical neckline with scallop trimmings leads to a one long sleeve design. The sheer skirt is graced with stunning appliques, a thigh-high side slit, and sweep train giving it extra glamour. Wear this Milano Formals gown to prom, formal event and homecoming to achieve that showstopping look - perfect for those who love understated luxury. Style: milano_E1929 Closure: Zipper Details: Long Sleeve, Fully Embroidered, Black Lining on Bodice, Thigh-High Side Slit. Sweep Train Fabric: Lace Length: Long Neckline: Assymetrical Waistline: Natural Silhouette: Fit and Flare Category: Long Dress Available Colors: Black Sizes: 00 Â– 18 This special occasion dress is returnable. Please refer to our special occasion dress return policy (click here) for more details..",https://www.lookmazing.com/milano-formals-glamourous-fully-embroidered-black-assymetrical-gown-e1929/products/15860211
E2008,"Aspiring to belong to the fashion forward crowd? This Milano Formals E2008 evening gown might just be your ticket to the big time. Intended to be a showpiece, this beauty includes an alluring halter illusion over a deep sweetheart neckline, a bead-speckled bodice and open back. Luring the eyes to the waist is a tiara-like beadwork embellishment that flows down into a swish of full length hem. Turn heads as you capture hearts with this Milano Formals gown. Style: milano_E2008 Closure: Zipper Details: Halter Illusion Over Deep Sweetheart Neckline, Intricately Beaded Bodice, Tiara-Patterned Beadwork on Waist, Open Back, Fit and Flare, Full Length Hem Fabric: Mikado Length: Long Neckline: Halter Illusion Waistline: Natural Silhouette: Fit and Flare Category: Long Dress Available Colors: Green Sizes: 00 Â– 18 This special occasion dress is returnable. Please refer to our special occasion dress return policy (click here) for more details..",https://www.lookmazing.com/milano-formals-embellished-mikado-sheer-evening-gown-e2008/products/15855685
E2319,No description found.,https://www.lookmazing.com/milano-formals-e2319-beaded-scoop-neck-ballgown/products/18418333
E2331,"All eyes will be on you in this elegant evening gown by Milano Formals E2331. This two piece gown brandishes in an off the shoulder neckline crop top embellished with beading. The back has a zipper closure while the full length ballgown skirt is accented with criss cross print patterns and a sweep train. This Milano Formals design will definitely parade your elegant and classy style on your next formal occasion. Style: milano_E2331 Fabric: French Organza Closure: Zipper Details: Two piece, Bead embellishments, Back zipper, Organza, Print, Ballgown skirt, Sweep train Length: Long Neckline: Off-Shoulder Waistline: Natural Silhouette: Ballgown This special occasion dress is returnable. Please refer to our special occasion dress return policy (click here) for more details..",https://www.lookmazing.com/milano-formals-e2331-two-piece-embellished-printed-ballgown/products/18418342
E2329,"Make your night one to remember wearing Milano Formals E2329. Features an off-shoulder neckline with beaded thin straps and belt. The back has a zipper closure while the ballgown skirt runs in full length hem. All eyes will be on you in this elegant evening gown by Milano Formals. Style: milano_E2329 Fabric: Lace Closure: Zipper Details: Off-shoulder sleeves, Beaded straps and belt, Sheer, Back zipper, Ballgown skirt Length: Long Neckline: Off-Shoulder Waistline: Natural Silhouette: Ballgown This special occasion dress is returnable. Please refer to our special occasion dress return policy (click here) for more details..",https://www.lookmazing.com/milano-formals-e2329-embellished-off-shoulder-ballgown/products/18941790
E2032,"Be the delight of everyoneÂ’s eyes in this long dress by Milano Formals E2032. Showcases a sleeveless, intricately beaded high neckline over the sweetheart liner that extends to the open back centered closure. The fitted bodice is accentuated with princess seams and the smooth skirt finishes in a full length hemline. This Milano Formals style is a timeless look suited for any formal party. Style: milano_E2032 Closure: Zipper Details: Sleeveless, Beaded neckline, Sweetheart liner, Fitted bodice, Princess seams, Open back centered closure, Smooth skirt Fabric: New Jersey Length: Long Neckline: Halter Waistline: Natural Silhouette: Sheath Category: Long Dress Available Colors: Blue Sizes: 00 Â– 18 This special occasion dress is returnable. Please refer to our special occasion dress return policy (click here) for more details..",https://www.lookmazing.com/milano-formals-sleeveless-beaded-high-neckline-floor-length-dress-e2032/products/15829039
