Code,Description,URL
E1344,"Surplice dress with bow by Milano FormalsFigure-flattering style is the name of the game with this strapless Milano Formals E1344 cocktail dress. Its surplice top features a sweetheart neckline and soft, elegant texturing. The high waist gives way to a simple pencil skirt. In between, a uniquely textured, oversize bow is positioned jauntily and brings the look full circle.",https://www.newyorkcitytop.shop/product/milano-formals-e1344-dress
E1618,Designer strapless and detailed ballgown from Milano FormalsYou look like a queen in this regal gown from Milano Formals E1618. An arced neckline enhances the strapless design. A royal motif of embroidery and accents spirals atop the bodice in a feminine design with a lace-up back. The vivid ballgown skirt expands to a flared layered design and ends in a full length hemline.,https://www.newyorkcitytop.shop/product/milano-formals-e1618-dress
E1823,"A one-shoulder gown featuring shiny sequins and a one leg slit by Milano FormalsA one-shoulder gown by Milano Formals E1823 featuring shimmery vertical patterns of sequins. The dress is form-fitting, and the fabric favors the slim figures of straight-shaped women. The skirt is adorned with a single slit up the leg for glamorous appearance and has an elongated hemline.",https://www.newyorkcitytop.shop/product/milano-formals-e1823-dress
E1977,Bedazzled Cocktail Dress by Milano FormalsRadiate beauty wearing this darling cocktail dress from Milano Formals E1977. This sleeveless dress has a high neckline and ornate shining embellishment throughout. This dress is fitted and moves into a straight skirt with a modest hem.,https://www.newyorkcitytop.shop/product/milano-formals-e1977-dress
E1978,Jeweled Cocktail Dress by Milano FormalsLook fabulous for your next formal party wearing this Milano Formals E1978 cocktail dress. This dress is sleeveless with a high neck. Shimmering beads and embellishment work throughout the fitted silhouette. The straight skirt finishes with a modest hem.,https://www.newyorkcitytop.shop/product/milano-formals-e1978-dress
E1980,Rose Print Cocktail Dress by Milano FormalsEmbrace a romantic look with this cocktail dress from Milano Formals E1980. This sleeveless dress has a smooth fitted bodice and nipped waist. The skater skirt is emblazoned with roses and finishes with a modest hem.,https://www.newyorkcitytop.shop/product/milano-formals-e1980-dress
E1986,"Amazing sale dress by Milano Formals E1986 Dress has a number of interesting features to get you noticed at your next event. These features include A-Line, Glittering Accents, High Neckline, Homecoming Dresses, Mini, Natural, No, Sleeveless And is currently priced at $99.",https://www.newyorkcitytop.shop/product/milano-formals-e1986-dress
E1989,Embellished Evening Gown by Milano FormalsLook fabulous for your next formal occasion wearing this Milano Formals E1989 evening gown. This sleeveless dress has sheer fabric at the upper portion. Contrast applique winds throughout the bodice. Woven detail sits at the waist. The skirt is smooth with a column silhouette and flared full length hem.,https://www.newyorkcitytop.shop/product/milano-formals-e1989-dress
E2010,Sheer and Shimmer Detail Evening Gown by Milano FormalsFeel ready to walk the red carpet in this chic evening gown by Milano Formals E2010. This sleeveless dress has sheer fabric at the upper portion. Fine shimmering detail works throughout the fitted bodice. The skirt has soft movement and finishes with a full length hem.,https://www.newyorkcitytop.shop/product/milano-formals-e2010-dress
E2016,"Strapless Embellished Evening Gown by Milano FormalsStrike a pose in this fabulous evening gown by Milano Formals E2016. Strapless, this dress has a pronounced sweetheart shape with princess seams at the bodice for a stunning fit. Contrast shining sequins sit at the waist. The skirt is smooth with a soft mermaid silhouette and finishes with a full length hem.",https://www.newyorkcitytop.shop/product/milano-formals-e2016-dress
E2017,Lace Detail Evening Gown by Milano FormalsMilano Formals E2017 wows us with this romantic evening gown. This sleeveless dress has sheer at the upper portion. Lace overlay accents the fitted bodice. The skirt has soft movement and a full length hem. It’s a gorgeous gown that’s sure to make the right impression.,https://www.newyorkcitytop.shop/product/milano-formals-e2017-dress
E2018,Strapless Origami Detail Evening Gown by Milano FormalsLook brilliant for your next formal party wearing this Milano Formals E2018 evening gown. This strapless dress has ornate origami folds at the upper portion and a cluster of tonal stones at center. The skirt is smooth with a soft sweep and flared full length hem. A dramatic train trails at back.,https://www.newyorkcitytop.shop/product/milano-formals-e2018-dress
E2019,"This item is NOT RETURNABLE
Jeweled Cocktail Dress by Milano FormalsGlitter in this fantastic cocktail dress from Milano Formals E2019. This sleeveless dress has a high neckline and tonal jeweled detail throughout. The fitted silhouette moves into a straight skirt and finishes with a mini hem.",https://www.newyorkcitytop.shop/product/milano-formals-e2019-dress
E2025,Sequins and Lace Cocktail Dress by Milano FormalsLight up the night in this Milano Formals E2025 evening gown. This sleeveless dress boasts a modest V-neckline. Tonal clusters of sequins peek from lace overlay throughout. The bodice is fitted and the skirt has a delicate sweep with a full length hem. It’s a red carpet-worthy look for any special occasion.,https://www.newyorkcitytop.shop/product/milano-formals-e2025-dress
E2028,"This item is NOT RETURNABLE
Vibrant Print Cocktail Dress by Milano FormalsGet noticed in this darling cocktail dress from Milano Formals E2028. This dress has a jewel neckline and fitted bodice with a nipped waist. The flared skirt finishes with a modest hem. Bold flowers are splashed across the dress for a brilliant print that stands out in any crowd.",https://www.newyorkcitytop.shop/product/milano-formals-e2028-dress
E2037,Jeweled Cocktail Dress by Milano FormalsLook lovely for your next formal occasion wearing this Milano Formals E2037 cocktail dress. This sleeveless dress boasts a high neckline and ornate jeweled detail throughout the bodice. This dress has a nipped waist. The skirt is smooth with soft movement and finishes with a mini hem.,https://www.newyorkcitytop.shop/product/milano-formals-e2037-dress
E2040,"Amazing sale dress by Milano Formals E2040 Dress has a number of interesting features to get you noticed at your next event. These features include after_prom, Body Conscious, Cocktail Dresses, cocktail_dresses, High Neckline, Homecoming Dresses, homecoming_dresses, Lace & Embroidery, milano_formals, Mini, Natural, No, Party Dresses, party_dresses, Sleeveless And is currently priced at $79.",https://www.newyorkcitytop.shop/product/milano-formals-e2040-dress
E2043,Lace Panel Detail Evening Gown by Milano FormalsChannel red carpet glamour wearing this Milano Formals E2043 evening gown. This sleeveless dress has a high neckline with lace panels at the bodice. The skirt is smooth with soft movement. This gown finishes with a full length hem.,https://www.newyorkcitytop.shop/product/milano-formals-e2043-dress
E2045,Gilded Embellishment Evening Gown by Milano FormalsLight up the night in this glamorous evening gown from Milano Formals E2045. This sleeveless dress has a scoop neckline with sheer inset at the center of the bodice. Shimmering gilded detail works throughout the gown and circles the waist. The skirt is smooth with soft movement and a slit at one side. This gown is full length hem.,https://www.newyorkcitytop.shop/product/milano-formals-e2045-dress
E2047,"Strapless Shimmering Detail Evening Gown by Milano FormalsAdd some drama to the night wearing this Milano Formals E2047 evening gown. Strapless, this dress has a pronounced sweetheart shape with fine shimmering detail throughout. The skirt has a soft flowing silhouette with a slit at one side. This gown is full length.",https://www.newyorkcitytop.shop/product/milano-formals-e2047-dress
E2048,Textured Lace Evening Gown by Milano FormalsGo for a showstopping look for your next formal party wearing this Milano Formals E2048 evening gown. This sleeveless dress has a high neckline with textured lace detail throughout the bodice. The skirt is smooth with a soft flared shape and finishes with a full length hem.,https://www.newyorkcitytop.shop/product/milano-formals-e2048-dress
E2049,"Strapless Glittering Cocktail Dress by Milano FormalsTurn up the heat in this sultry cocktail dress by Milano Formals E2049. Strapless, this dress has a pronounced sweetheart shape with fine glittering detail throughout. A contrast band rounds the waist. The skirt is straight with shimmering accents and finishes with a modest hem.",https://www.newyorkcitytop.shop/product/milano-formals-e2049-dress
E2050,"Strapless Shimmer Print Cocktail Dress by Milano FormalsMake waves in this stunning cocktail dress from Milano Formals E2050. This dress is strapless with a distinct sweetheart shape and sheer inset at the center of the bust. Shimmering detail creates a graphic print throughout the fitted dress. The skirt finishes with a modest hem. It’s a modern, glamorous look for any special occasion.",https://www.newyorkcitytop.shop/product/milano-formals-e2050-dress
E2059,"This item is NOT RETURNABLE
Vibrant Sequins Cocktail Dress by Milano FormalsMilano Formals E2059 goes trendy with this darling cocktail dress. This sleeveless dress has a bold array of sequins at the fitted bodice. The bodice is flanked with cutout details. This dress has a nipped waist and skater-style skirt with a modest hem. It’s a fun look that says you’re ready to party!",https://www.newyorkcitytop.shop/product/milano-formals-e2059-dress
E2061,"Amazing sale dress by Milano Formals E2061 Dress has a number of interesting features to get you noticed at your next event. These features include A-Line, Halter, Homecoming Dresses, Lace & Embroidery, Mini, Natural, No, Sleeveless And is currently priced at $99.",https://www.newyorkcitytop.shop/product/milano-formals-e2061-dress
E2063,"Subtle Beaded Cocktail Dress by Milano FormalsMilano Formals E2063 brings you a classic cocktail dress with this look. Sleeveless, this dress has a jewel neckline with a smooth bodice and shimmering detail at the waist. The skirt is full with a modest hem. It’s a staple for any after five wardrobe.",https://www.newyorkcitytop.shop/product/milano-formals-e2063-dress
E2065,"This item is NOT RETURNABLE
Glittering Detail Evening Gown by Milano FormalsShimmer for your next special party wearing this Milano Formals E2065 evening gown. This dress has embellished wide straps and a sweetheart shape. Shimmering detail sits at the waist. The skirt is smooth with a soft sweep and finishes with a full length hem.",https://www.newyorkcitytop.shop/product/milano-formals-e2065-dress
E2069,Glittering Detail Evening Gown by Milano FormalsMilano Formals E2069 brings the glam with this gorgeous evening gown. This sleeveless dress has a high neckline with glittering detail throughout the fitted bodice. This dress has a nipped waist with a distinct A-line skirt and full length hem. It’s a brilliant pick for any special event.,https://www.newyorkcitytop.shop/product/milano-formals-e2069-dress
E2070,Lace Evening Gown by Milano FormalsStand out in this red carpet-worthy evening gown from Milano Formals E2070. This dress has a high neckline with glittering detail at the neckline. Ornate lace works throughout the fitted silhouette. The skirt moves into a subtle mermaid shape with tulle overlay at the full length hem.,https://www.newyorkcitytop.shop/product/milano-formals-e2070-dress
E2074,Long-Sleeved Glittering Evening Gown by Milano FormalsMake it your moment to shine in this gorgeous evening gown by Milano Formals E2074. This dress has ornate shimmering sequins throughout the upper portion and long sleeves. This dress has a sweetheart shape and smooth bust. Sheer fabric is embellished with glittering detail at the waist. The skirt is smooth and finishes with a softly flared full length hem.,https://www.newyorkcitytop.shop/product/milano-formals-e2074-dress
E2078,Two-Piece Shining Gems Cocktail Dress by Milano FormalsShine for your next formal occasion wearing this Milano Formals E2078 two-piece cocktail dress. The cropped top has a high neckline and rich shining gems at the fitted bodice. The midriff is exposed. Tonal gems round the high waist. The skirt has a soft flared silhouette with sheer overlay and finishes with a modest hem.,https://www.newyorkcitytop.shop/product/milano-formals-e2078-dress
E2081,Ruched Detail Cocktail Dress by Milano FormalsStep out wearing this sophisticated cocktail dress from Milano Formals E2081. This sleeveless dress boasts princess seams at the fitted bodice. Ruching wraps the waist. The straight skirt and finishes with a modest hem. It’s a go-to frock fit for any party.,https://www.newyorkcitytop.shop/product/milano-formals-e2081-dress
E2082,High Neck Sleek Evening Gown by Milano FormalsHave your red carpet moment wearing this Milano Formals E2082 evening gown. This sleeveless dress boasts a high neckline with light ruching at the upper portion. The bodice is smooth and fitted. The skirt has a soft flared silhouette and finishes with a full length hem.,https://www.newyorkcitytop.shop/product/milano-formals-e2082-dress
E2083,"Sleek Bow Detail Evening Gown by Milano FormalsMilano Formals E2083 brings this sweet, sophisticated gown for your next special occasion. This sleeveless dress has a V-neckline with delicate lace overlay. A tonal band rounds the waist with a flat bow at the waist. The skirt has a dramatic sweep and finishes with a full length hem.",https://www.newyorkcitytop.shop/product/milano-formals-e2083-dress
E2084,"This item is NOT RETURNABLE
Mesh Lace Cocktail Dress by Milano FormalsSet the tone for the night wearing this Milano Formals E2084 cocktail dress. This dress has mesh lace at the upper portion and half sleeves. This dress has a sweetheart shape with a structured bodice. Satin-like fabric wraps the bodice. The skirt is straight and finishes with a modest hem.",https://www.newyorkcitytop.shop/product/milano-formals-e2084-dress
E2087,Lace and Rosette Evening Gown by Milano FormalsGet swept away in romance wearing this evening gown from Milano Formals E2087. This sleeveless dress has lace fabric at the upper portion with a sweetheart shape. This dress has a nipped waist with a rosette detail at one side. The skirt is smooth with gentle movement and finishes with a full length hem.,https://www.newyorkcitytop.shop/product/milano-formals-e2087-dress
E2088,"Lace and Rosette Cocktail Dress by Milano FormalsGet noticed in this fabulous cocktail dress by Milano Formals E2088. This dress has delicate lace fabric at the upper portion and quarter length sleeves. This dress has a fitted, structured bodice with a tonal band at the waist. A rosette sits at one side. The straight skirt finishes with a modest hem.",https://www.newyorkcitytop.shop/product/milano-formals-e2088-dress
E1991,Fine Shimmer Evening Gown by Milano FormalsStep out and shine in this Milano Formals E1991 evening gown. This dress has cap sleeves with fine shimmering detail at the sheer upper portion. Glittering embellishment continues at the fitted bodice. The skirt has a soft movement and finishes with a full length hem.,https://www.newyorkcitytop.shop/product/milano-formals-e1991-dress
E2008,Tonal Beaded Sheer Evening Gown by Milano FormalsLook amazing for your next formal party wearing this Milano Formals E2008 evening gown. This sleeveless dress has sheer fabric at the upper portion. Fine tonal beading accents the fitted structured bodice. This dress has a nipped waist with a flowing skirt and finishes with a full length hem.,https://www.newyorkcitytop.shop/product/milano-formals-e2008-dress
E2031,Shining and Sheer Evening Gown by Milano FormalsMilano Formals E2031 brings on the glam with this fantastic evening gown. This dress is sleeveless with a smooth bodice. Glittering stones round the waist. The skirt is smooth with sheer panels. The gown finishes with a gentle flowing full length hem.,https://www.newyorkcitytop.shop/product/milano-formals-e2031-dress
E2046,Off-the-Shoulder Ruched Evening Gown by Milano FormalsFeel ready to walk the red carpet. This gown is off-the-shoulder with light ruching at the bodice. This dress has a nipped waist with a full A-line skirt. This gown has slant pockets for a modern touch. The look finishes with a full length gown.,https://www.newyorkcitytop.shop/product/milano-formals-e2046-dress
E2057,Sheer Beaded Evening Gown by Milano FormalsCreate a dreamy evening in this Milano Formals E2057 evening gown. This sleeveless dress has sheer fabric at the upper portion with fine beading throughout. This dress has a sweetheart shape with a tonal band at the waist. The skirt is full with an A-line silhouette and finishes with a floor length hem.,https://www.newyorkcitytop.shop/product/milano-formals-e2057-dress
E2089,Two-Piece Lace Evening Gown by Milano FormalsMake it your moment to stand out wearing this Milano Formals E2089 two-piece evening gown. The cropped top has a high neckline with short sleeves. Rich lace overlay works throughout the bodice. The midriff is exposed. The matching skirt has a high waist with lace detail. The skirt has a soft flowing shape and finishes with a full length hem.,https://www.newyorkcitytop.shop/product/milano-formals-e2089-dress
E2092,Two-Piece Glittering Evening Gown by Milano FormalsMake a splash in this fabulous formal gown from Milano Formals E2092. The cropped top has a high neckline with a cutout detail. Fine shimmering detail shines throughout. The midriff is exposed. The coordinating skirt has glittering embellishment at the high waist. The skirt has a soft flared shape with sheer overlay. This gown finishes with a full length hem.,https://www.newyorkcitytop.shop/product/milano-formals-e2092-dress
E2094,Off-the-Shoulder Fine Shimmering Evening Gown by Milano FormalsLook amazing for your next formal party wearing this Milano Formals E2094 evening gown. This dress is off-the-shoulder with tonal beading throughout the fitted bodice. The skirt is smooth with a soft draped effect and finishes with full length hem.,https://www.newyorkcitytop.shop/product/milano-formals-e2094-dress
E2096,Jeweled Detail Evening Gown by Milano FormalsLook brilliant for your next special occasion wearing this Milano Formals E2096 evening gown. This dress has a jewel neckline and cap sleeves embellished with dazzling stones. The bodice has a relaxed fit and a nipped waist highlighted with shining detail. The skirt is smooth with a soft flowing shape and finishes with a full length hem.,https://www.newyorkcitytop.shop/product/milano-formals-e2096-dress
E2100,Long-Sleeved Sheer and Shimmering Evening Gown by Milano FormalsMake waves in this standout evening gown from Milano Formals E2100. This dress has long sheer sleeves with fine shimmering beadwork throughout. Jeweled detail sits at the neckline and sheer panels boast additional beadwork. Light ruching works at the bodice. The skirt is smooth with a draped silhouette. This gown finishes with a full length hem.,https://www.newyorkcitytop.shop/product/milano-formals-e2100-dress
E2103,Embellished Evening Gown by Milano FormalsMilano Formals E2103 brings the glam with this chic evening gown. This dress has a high neckline and cap sleeves. Fine beading embellishes the fitted bodice. The skirt is smooth with a soft flared shape and A-line shape. This gown finishes with a full length hem.,https://www.newyorkcitytop.shop/product/milano-formals-e2103-dress
E2104,Glittering Evening Gown by Milano FormalsStand out wearing this Milano Formals E2104 evening gown. This dress is sleeveless with fine shimmering stones throughout the fitted bodice. This dress has a nipped waist and pronounced A-line skirt with layers of tulle. This gown finishes with a full length hem.,https://www.newyorkcitytop.shop/product/milano-formals-e2104-dress
E2110,Lace Bell Sleeve Evening Gown by Milano FormalsChannel your trendy side in this fantastic gown by Milano Formals E2110. This dress has lace bell sleeves and a deep V-neckline. This gown is fitted at the bodice. The skirt has a soft draped silhouette with lace overlay throughout for rich texture. The skirt has a slit and the dress finishes with a full length.,https://www.newyorkcitytop.shop/product/milano-formals-e2110-dress
E2116,Two-Piece Floral Beaded Evening Gown by Milano FormalsLook fantastic for your next formal party in this two-piece evening gown by Milano Formals E2116. The cropped top has a high neckline with a keyhole detail. Vibrant beading works throughout the fitted bodice. The midriff is exposed. The coordinating skirt has gorgeous beadwork with a smooth flowing silhouette and full length hem.,https://www.newyorkcitytop.shop/product/milano-formals-e2116-dress
E2118,Tonal Applique Evening Gown by Milano FormalsCreate a night of luxury in this Milano Formals E2118 evening gown. This dress is sleeveless with a high neckline and sheer detail at the upper portion. Rich tonal applique works throughout the fitted bodice. This dress has a nipped waist and pronounced A-line skirt. This gown finishes with a full length hem.,https://www.newyorkcitytop.shop/product/milano-formals-e2118-dress
E2119,Bejeweled Evening Gown by Milano FormalsGet ready to sparkle in this evening gown from Milano Formals E2119. This dress has an embellished glittering neckline with a dramatic cutout detail. The bodice is fitted. The skirt gently drapes and finishes with a full length hem. It’s a standout look everyone will remember.,https://www.newyorkcitytop.shop/product/milano-formals-e2119-dress
E2134,Shining Detail Evening Gown by Milano FormalsLook brilliant for the next big party wearing this Milano Formals E2134 evening gown. This dress has a high neckline and sheer fabric at the upper portion. This dress has a sweetheart shape. Tonal shining detail works throughout the gown for a glamorous touch. This dress has a nipped waist with a flowing A-line shape and finishes with a full length hem.,https://www.newyorkcitytop.shop/product/milano-formals-e2134-dress
E2150,Shimmering Ruffled Evening Gown by Milano FormalsMilano Formals E2150 does glam better than the rest with this ornate evening gown. This sleeveless dress has sheer fabric at the upper portion. Rich applique creates a flower-like motif at the bodice. The skirt is full with ruffled detail and finishes with a floor length hem.,https://www.newyorkcitytop.shop/product/milano-formals-e2150-dress
E2158,"Floral Lace Cape Detail Evening Gown by Milano Formals
Make waves in this fabulous bohemian-inspired look from Milano Formals E2158. Rich lace fabric moves throughout this gown for a romantic look packed with texture. Flowing sleeves create a cape-like detail. This dress has a fluid silhouette and full length hem.",https://www.newyorkcitytop.shop/product/milano-formals-e2158-dress
E2163,"Strapless Lace Evening Gown by Milano FormalsLook amazing for your grand entrance wearing this Milano Formals E2163 evening gown. Strapless, this dress has a distinct sweetheart shape with sheer fabric at the center of the bust. Lace overlay works throughout the structured silhouette. A tonal band wraps the waist. The skirt has a flowing A-line shape with lace overlay. This gown finishes with a full length hem.",https://www.newyorkcitytop.shop/product/milano-formals-e2163-dress
E2174,Shimmering Evening Gown by Milano FormalsGet ready to sparkle in this glamorous evening gown by Milano Formals E2174. This dress has a halter-style neckline with fine shimmering detail throughout the fitted bodice. This dress has a nipped waist and flowing column skirt. This gown finishes with a full length hem.,https://www.newyorkcitytop.shop/product/milano-formals-e2174-dress
E2178,Two-Piece Jeweled Evening Gown by Milano FormalsEveryone will take not when you walk in wearing this Milano Formals E2178 evening gown. The cropped top has a high neckline with an exposed back. Shining tonal jewels cover the fitted bodice. The midriff is exposed. The coordinating skirt has jewels at the high waist. The skirt is smooth with a flowing silhouette and finishes with a full length hem.,https://www.newyorkcitytop.shop/product/milano-formals-e2178-dress
E2204,"Amazing sale dress by Milano Formals E2204 has a number of interesting features to get you noticed at your next event. These features include Fit & Flare, Homecoming Dresses, homecoming_dresses, Lace & Embroidery, little_black_dresses, milano_formals, Mini, Natural, No, Prom Short Dresses, prom_short_dresses, Sleeveless, Strapless And is currently priced at $125.",https://www.newyorkcitytop.shop/product/milano-formals-e2204
E2210,Snake Detail Sheath Dress by Milano FormalsGet noticed wearing this cocktail dress from Milano Formals E2210. This dress is sleeveless with a classic sheath silhouette. Sheer accent sits at the upper portion and flank the bodice. Snake detail panels work throughout the bodice and the fitted skirt is straight with a modest hem. It’s a fresh feel for any formal party.,https://www.newyorkcitytop.shop/product/milano-formals-e2210-dress
E2213,Sheer and Applique Cocktail Dress by Milano FormalsMilano Formals E2213 brings you the glam with this chic cocktail dress. This dress is sleeveless with sheer fabric at the upper portion. The bodice is fitted and embellished detail sit at the waist. The skirt has a straight silhouette and modest hem. Ornate lace overlay creates a look packed with contrast for a showstopping look.,https://www.newyorkcitytop.shop/product/milano-formals-e2213-dress
