Code,Description,URL
E2037,"Look stunning in this vogue cocktail dress by Milano Formals E2037. The dress brandishes in a sleeveless high neck, beautifully beaded fitted bodice and a mid-open back. The smooth A-line skirt gently flares and finishes in a modest hem. Go with this refreshing by Milano Formals. Style: milano_E2037 Closure: Zipper Details: Sleeveless, High Neck, Bejeweled bodice, Mid-open back, Flared skirt Fabric: Satin Length: Short Neckline: High Waistline: Natural Silhouette: A-line Category: Short Dress Available Colors: Green, Black Sizes: 00 Â– 18 This special occasion dress is returnable. Please refer to our special occasion dress return policy (click here) for more details..",https://www.lookmazing.com/milano-formals-sleeveless-bejeweled-high-neck-cocktail-dress-e2037/products/15829052
E2269,"Appear like a modern princess with the unique beadwork of Milano Formals E2269. This fitted dress features a stunning sheer jewel neckline and a bodice that is adorned with contrasting beading that creates an intricate design. Its slim fitting silhouette will show off your figure as it hugs your curves in all the right places. Turn heads at your upcoming senior homecoming in this captivating Milano Formals design. Style: milano_E2269 Details: Jewel neckline, Illusion, Sleeveless, Beaded bodice, Back zip closure Length: Short Neckline: Jewel Waistline: Natural Silhouette: Column This special occasion dress is returnable. Please refer to our special occasion dress return policy (click here) for more details..",https://www.lookmazing.com/milano-formals-e2269-sleeveless-sheer-beaded-short-dress/products/17437208
E2000,"All eyes on you even in amidst the fashion forward crowd with this tiered cocktail beauty by Milano Formals E2000. This vision of femininity features a two-piece crop top and coordinating skirt ensemble. Detailed with a lovely frame of beaded halter illusion neckline, the dress features a bodice crusted with a display of exotic beadwork and an open back with beaded horizontal bands. Its waist is cinched by an artfully embellished band. The taffeta tiered skirt flares into a dainty shape adored by the fashion forward crowd. Create the right kind of attention with this Milano Formal style. Style: milano_E2000 Closure: Zipper Details: Cropped top and coordinating skirt, Exposed Midriff, Intricately Beaded Bodice, Tiered Taffeta Flare Skirt, Open Back with Beaded Horizontal Bands, Beaded Waistband Fabric: Taffeta Length: Short Neckline: Halter Illusion Waistline: Natural Silhouette: Flare Category: Short Dress Available Colors: Blue Sizes: 00 Â– 18 This special occasion dress is returnable. Please refer to our special occasion dress return policy (click here) for more details..",https://www.lookmazing.com/milano-formals-beaded-tiered-taffeta-short-cocktail-dress-e2000/products/15855684
E2077,"Create your desired dramatic entrance with this rare jewel of a dress from Milano Formals E2077. This fascinating piece is beautifully adorned with a sparkling array of gunmetal beads from its high halter neckline down to its fitting bodice. Overlaid with the same exquisite beads, both its single panel waistband and open back strap details top off this beauty. A flowy chiffon skirt finishes this lovely Milano Formals piece for that perfect touch of glamour. Style: milano_E2077 Closure: Zipper Details: Geometrically Beaded Bodice, High Halter Neckline, Chiffon Flare Skirt, Open Back, Beaded Single Panel Waistband Fabric: Chiffon Length: Short Neckline: Halter Waistline: Natural Silhouette: Flare Category: Short Dress Available Colors: Gray Sizes: 00 Â– 18 This special occasion dress is returnable. Please refer to our special occasion dress return policy (click here) for more details..",https://www.lookmazing.com/milano-formals-beaded-halter-chiffon-cocktail-dress-e2077/products/15829120
E2252,"Portray the rich variety in design of this dress by Milano Formals E2252. The dress flaunts a sleeveless, illusion jewel neckline. The bodice is richly decorated with amazing bead work. This formal fitted dress is suitable for any occasion. With an amazing illusion back really makes this dress pop. Get noticed in this radiant dress from Milano Formals. Style: milano_E2252 Details: Heavy beading, Sheer, Sleeveless, Sheer, Sweetheart lining, Sheath skirt, Back zipper closure Length: Short Neckline: Illusion Jewel Waistline: Natural Silhouette: Sheath This special occasion dress is returnable. Please refer to our special occasion dress return policy (click here) for more details..",https://www.lookmazing.com/milano-formals-e2252-beaded-illusion-jewel-sheath-dress/products/17437191
E2345,"Elegance with a touch of sparkle perfectly describes this beautiful Milano Formals E2345 evening dress. This stunning style showcases a sexy v-neckline thus a draped bodice paired with spaghetti straps leads into a criss cross open back. The fitted silhouette features an intricate beaded pattern and is made out of a rich net material that keeps you comfortable as you dance the night away. This stunner is secured with a back center zipper closure. Look magnificent in this vintage dress from Milano Formals creation. Style: milano_E2345 Fabric: Mesh Closure: Zipper Details: Sleeveless, Spaghetti Straps, Fully Beaded, Draped Bodice, Floor Length, Criss Cross Back, Back Zipper Closure Length: Long Neckline: V-Neck Waistline: Natural Silhouette: Sheath This special occasion dress is returnable. Please refer to our special occasion dress return policy (click here) for more details..",https://www.lookmazing.com/milano-formals-e2345-beaded-v-neck-draped-evening-dress/products/18429901
E2027,"Preen and sashay your way to the top with this gorgeous dress from Milano Formals E2027. Displaying a pop of surprise with its skin toned mesh midriff panel, this piece displays a bateau neckline, closed back and a daintily beaded bodice. Lining its waist is a band of beautifully sewn beadwork, the skirt then flows into a swirly mini hem perfect in showcasing those lovely stilettoes. Strut, flaunt and shine with this jewel of a creation by Milano Formals. Style: milano_E2027 Closure: Zipper Details: Cropped Top and Skirt Ensemble, Sheer Mesh Midriff Panel, Intricately Beaded Bodice, Beaded Waistband, A-line Skirt, Closed Back Fabric: Taffeta Length: Short Neckline: Bateau Illusion Waistline: Natural Silhouette: A-Line Category: Short Dress Available Colors: Red Sizes: 00 Â– 18 This special occasion dress is returnable. Please refer to our special occasion dress return policy (click here) for more details..",https://www.lookmazing.com/milano-formals-bejeweled-taffeta-illusion-cocktail-dress-e2027/products/15829024
E2030,"Show off your feminine side with this cocktail dress from Milano Formals E2030. This sleeveless dress features an illusion bateau neckline under a sweetheart liner richly styled with precise beadwork that spreads at the back with a keyhole opening. The waist is accentuated by curved ends where the satin skirt begins its flare. You will definitely be everyoneÂ’s darling with this Milano Formals dress. Style: milano_E2030 Closure: Zipper Details: Sweetheart Liner, Sequined beadwork, Detailed waistline, Illusion Bodice, Back with keyhole opening, A-line skirt Fabric: Mikado Length: Short Neckline: Bateau Waistline: Natural Silhouette: A-Line Category: Short Dress Available Colors: Pink Sizes: *00 Â– 30 This special occasion dress is returnable. Please refer to our special occasion dress return policy (click here) for more details..",https://www.lookmazing.com/milano-formals-sequined-sleeveless-bateau-neck-illusion-bodice-cocktail-dress-e2030/products/15828976
E2072,"Be the very epitome of understated opulence with this gorgeous evening gown from Milano Formals E2072. This beautifully crafted dress has a high halter mesh over a sweetheart neckline and a figure flattering cinched waist detail perfect for that tailored look. Overlaid with an elegant decorative net, its sheath silhouette basically flows seamlessly down to a floor length hem. Never wonder why everybodyÂ’s eyes are on you with this Milano Formals evening gown. Style: milano_E2072 Closure: Zipper Details: Decorative Lace-like Mesh Overlay, Halter Mesh over a Sweetheart Neckline, Cinched Waistline, Sheath Silhouette Fabric: Net Length: Long Neckline: Sweetheart Illusion Waistline: Natural Silhouette: Sheath Category: Long Dress Available Colors: Black Sizes: 00 Â– 18 This special occasion dress is returnable. Please refer to our special occasion dress return policy (click here) for more details..",https://www.lookmazing.com/milano-formals-decorative-mesh-evening-gown-e2072/products/15829109
E2398,"Take their breath away with this stunning dress by Milano Formals E2398. This sexy dress showcases a V-neckline and fitted bodice that is adorned with exquisite bead work and embellished jewel accent. A thick embellished belt clenches your waistline flattering your figure while a low sexy back adds a glamorous effect. A front side slit and small swept train completes this sexy look. Another great creation by Milano Formals. Style: milano_E2398 Fabric: Jersey Closure: Zipper Details: Jewel accent, Beaded, Sleeveless, Sheath skirt, High slit, Back cutouts, Back zip closure Length: Long Neckline: V-neck Waistline: Empire Silhouette: Sheath This special occasion dress is returnable. Please refer to our special occasion dress return policy (click here) for more details..",https://www.lookmazing.com/milano-formals-e2398-bedazzled-v-neck-sheath-dress/products/18418318
E2431,"Surround yourself with the sparkle of glamour when you walk in this dazzling evening gown by Milano Formals E2431. The bodice features a halter neckline with an illusion deep V-cutout and an embellished belt hitting flawlessly on your waist to give you a stunning slimming silhouette. The sheath silhouette skirt in full-length hemline showcases an ombre sequined pattern. This Blush creation is sure to make you steal the show. Style: milano_E2431 Fabric: Sequins Closure: Zipper Details: Sequins, Sleeveless, Sheer deep V-cutout on the bodice, Beaded belt, Open back, Back zipper closure, Ombre pattern skirt Length: Long Neckline: Halter Waistline: Natural Silhouette: Sheath This special occasion dress is returnable. Please refer to our special occasion dress return policy (click here) for more details..",https://www.lookmazing.com/milano-formals-e2431-halter-neck-sequined-sheath-gown/products/18439428
E2050,"Give the crown something to talk about with this intricately sewn beaded Milano Formals E2050 cocktail dress. This creation features the dramatic showcase of well-placed royal blue rhinestones in a exquisite geometric pattern. Strands of the same rhinestones were used to create the cinched waistline that every girl adores. Awake the style vixen in you with this Milano Formals gown. Style: milano_E2050 Closure: Zipper Details: Low Sweetheart Netted Neckline, Thigh Length, Fitted Silhouette, Low Back, Blue Geometric Bead Details, Beaded Waistband Fabric: Lace/Beading Length: Short Neckline: Sweetheart Waistline: Natural Silhouette: Sheath Category: Short Dress Available Colors: Black, Blue Sizes: 00 Â– 18 This special occasion dress is returnable. Please refer to our special occasion dress return policy (click here) for more details..",https://www.lookmazing.com/milano-formals-graphic-rhinestone-embellished-cocktail-dress-e2050/products/15829075
E2430,"Look jaw dropping in this dramatic dress by Milano Formals E2430. This gorgeous dress showcases a fitted sheath silhouette with a high slit design and is adorned with stunning sequins. The bodice features an off the shoulder neckline that also creates a sleeve effect for this dress. An open back with cutout design adds a unique touch to this dress making it even more special. This Milano Formals dress will surely make you feel all royal and radiant looking. Style: milano_E2430 Fabric: Sequins Closure: Zipper Details: Off shoulder sleeves, Sequins, Sheath skirt, High slit, Back cutout, Back zip closure Length: Long Neckline: Off Shoulder Waistline: Natural Silhouette: Sheath This special occasion dress is returnable. Please refer to our special occasion dress return policy (click here) for more details..",https://www.lookmazing.com/milano-formals-e2430-sequin-off-shoulder-sheath-dress/products/18418321
E2213,"Look impressively exquisite at your much-awaited monumental event in this intricately embellished Milano Formals E2213 creation. Fabulously sheathed in a sheer fabric overlay over a stunningly sculpted lining, this exquisite piece flaunts a jewel illusion over a sweetheart neckline and a keyhole cutout gossamer back. Festooned with a harmonious blend of intricate lace appliques and lattice beadwork, the sheath skirt skims along the female form and ends in an impeccable short hem. Inspire appreciative glances and captivated stares in this ultra-chic Milano Formals masterpiece. Style: milano_E2213 Details: Sleeveless, Embellished Waistband, Lattice Beadwork, Intricate Lace Applique Keyhole Cutout, Illusion Open Back, Back Zipper Closure, Short Hem Length: Short Neckline: Illusion Jewel Waistline: Natural Silhouette: Sheath This special occasion dress is returnable. Please refer to our special occasion dress return policy (click here) for more details..",https://www.lookmazing.com/milano-formals-e2213-sleeveless-embellished-sheer-lace-dress/products/18941758
E2251,"Shine through the night in this mesmerizing Milano Formals E2251 short dress will. This dress brandishes in a sleeveless, illusion jewel neckline with bodice heavily decorated with glittering patterned beadwork. The bodice has a figure flattering silhouette that leads to the sheath skirt. Stand out in every occasion with this daring creation by Milano Formals. Style: milano_E2251 Details: Heavy beading, Zipper, Sleeveless, Sheer, Fitted bodice, Sheath skirt Length: Short Neckline: Illusion Jewel Waistline: Natural Silhouette: Sheath This special occasion dress is returnable. Please refer to our special occasion dress return policy (click here) for more details..",https://www.lookmazing.com/milano-formals-e2251-beaded-illusion-jewel-dress/products/17437188
E2036,"Sparkle any event in this exquisite cocktail dress by Milano Formals E2036. Grab everyoneÂ’s attention with this short sleeveless dress with high neckline and a mid-keyhole opening. The fitted bodice is styled with precise beadwork that splays to the cutout back. At the cinch waist, the smooth A-line skirt begins its flare and completes the look in a modest hem This Milano Formals creation is truly remarkable! Style: milano_E2036 Closure: Zipper Details: Sleeveless, High neckline with mid keyhole opening, Beaded Bodice, Cutout back, A-line skirt Fabric: Mikado Length: Short Neckline: High Waistline: Natural Silhouette: A-line Category: Short Dress Available Colors: Green Sizes: *00 Â– 30 This special occasion dress is returnable. Please refer to our special occasion dress return policy (click here) for more details..",https://www.lookmazing.com/milano-formals-sleeveless-beaded-high-neck-cocktail-dress-e2036/products/15829048
E2018,"Display yourself at its finest in this immaculate evening gown by Milano Formals 2018 evening gown. Made by the finest Mikado fabric, this strapless stunner has an origami pleated fan neckline and diamond-shaped cluster of beadwork on its bodice. The beadwork traverses to the pleated open back. Fitting its bodice like a glove, the skirt cascades down to a dramatic train fit for royalty. Exude charm and flair with this stunning piece from Milano Formals. Style: milano_E2018 Closure: Zipper Details: Fan-bustline, Clustered-midriff Beadwork, Fit and Flare Silhouette, Pleated Open Back Detail, Floor Length Train Fabric: Mikado Length: Long Neckline: Fan Waistline: Natural Silhouette: Fit and Flare Category: Long Dress Available Colors: Green Sizes: 00 Â– 30 This special occasion dress is returnable. Please refer to our special occasion dress return policy (click here) for more details..",https://www.lookmazing.com/milano-formals-origami-mikado-evening-gown-e2018/products/15855690
E2344,"Simplicity and elegance is highly defined in this Milano Formals E2344 evening dress. Featuring a fitted bodice with sleeveless cut and scoop neckline, this stunner is adorned with exquisite bead work and sequins sewn in an intricate pattern. A fit and flare style finishes off this floor length ensemble. The full back is enclosed with a center zipper closure. Be in this gorgeous Milano Formals creation and leave a lasting impression. Style: milano_E2344 Fabric: Mesh Closure: Zipper Details: Sleeveless, Sequined, Fitted, Floor Length, Nude Inset Underneath, Full Back, Back Zipper Closure Length: Long Neckline: Scoop Waistline: Natural Silhouette: Sheath This special occasion dress is returnable. Please refer to our special occasion dress return policy (click here) for more details..",https://www.lookmazing.com/milano-formals-e2344-sequined-scoop-fitted-evening-dress/products/18429900
E2210,"Make a stylishly inspired statement at your dinner party of special event in this ultra-chic Milano Formals E2210 creation. Embellished with an array of metallic sheened beads along a sheer paneled bodice, this elegant piece showcases a sleeveless illusion bateau over a sweetheart neckline line with trimmed ornaments from the front to its gossamer full back. Glistening with a patterned band of jewels, the textured sheath skirt adheres along your luscious contours as it ends at a short hemline. Be bold and be ravishing without any excuses in this fabulous Milano Formals masterpiece. Style: milano_E2210 Details: Sleeveless, Beads, Illusion Panels, Textured Skirt, Back Zipper Closure Illusion Full Back, Short Hem Length: Short Neckline: Illusion Bateau Waistline: Natural Silhouette: Sheath This special occasion dress is returnable. Please refer to our special occasion dress return policy (click here) for more details..",https://www.lookmazing.com/milano-formals-e2210-beaded-illusion-panel-dress/products/17453200
E2109,"Make a statement with this long dress by Milano Formals E2109. The dress features cap sleeved bateau neckline with contrasting chic belt and a form fitting flared skirt that finishes in a full length hem. This Milano Formals dress is perfect for standout style and flawless fit. Style: milano_E2109 Closure: Zipper Details: Cap sleeves, Lace detail at the back, Flared skirt, Contrast belt Fabric: Stretch Satin Length: Long Neckline: Jewel Waistline: Natural Silhouette: Fit and Flare Category: Long Dress Available Colors: Red Sizes: 00 Â– 30 This special occasion dress is returnable. Please refer to our special occasion dress return policy (click here) for more details..",https://www.lookmazing.com/milano-formals-cap-sleeve-jewel-neck-fit-and-flare-long-dress-e2109/products/15828989
E2448,"Get that royal look with this creation by Milano Formals E2448. This gorgeous style is adorned in a vertical stripped embellished pattern all throughout its fitted sheath silhouette. Has the perfect finish with a modest high halter neckline and full covered closed back that ends with a zipper closure. Get noticed in this radiant dress from Milano Formals. Style: milano_E2448 Fabric: Mesh Closure: Zipper Details: Sleeveless, Embellished, Sheath skirt, Closed back, Back zip closure Length: Long Neckline: High Halter Waistline: Natural Silhouette: Sheath This special occasion dress is returnable. Please refer to our special occasion dress return policy (click here) for more details..",https://www.lookmazing.com/milano-formals-e2448-embellished-high-halter-sheath-dress/products/18418323
E2257,"Shine through the night in this mesmerizing Milano Formals E2257 cocktail dress. Glittering dress features a lovely sweetheart neckline paired with spaghetti straps that lead into a lovely mid opened back with a zipper closure. The fitted bodice showcases outstanding bead work and lovely designs that is sure to stand out from the crowd. The sheath skirt is mid-thigh length hem. Short enough to show off your legs but long enough to feel covered and modest, this Milano Formals design is sure to bring you unforgettable evening. Style: milano_E2257 Details: Sequined, Sleeveless, Spaghetti Straps, Fitted, Mid-Open Back, Back Zipper, Mid-Thigh Length Hem Length: Short Neckline: Sweetheart Waistline: Natural Silhouette: Sheath This special occasion dress is returnable. Please refer to our special occasion dress return policy (click here) for more details..",https://www.lookmazing.com/milano-formals-e2257-sequined-sweetheart-sheath-dress/products/17437201
E2256,"Sequins take on a whole new meaning on this short and classy Milano Formals E2256 cocktail dress. This show stopper design features an illusion jewel neckline with a sweetheart lining paired with net illusion quarter length sleeves with glimmering sequins. The fitted ensemble highlights full embellishment of dazzling sequins. The sheath skirt finishes to a mini hem. The sheer back highlights a keyhole and center zipper closure. You are sure to be noticed in this glamorous Milano Formals creation. Style: milano_E2256 Details: Illusion Neckline and Quarter Length Sleeves, Sequined, Short Hem, Back Keyhole, Back Zipper Closure Length: Short Neckline: Illusion Jewel Waistline: Natural Silhouette: Sheath This special occasion dress is returnable. Please refer to our special occasion dress return policy (click here) for more details..",https://www.lookmazing.com/milano-formals-e2256-sequined-illusion-jewel-sheath-cocktail-dress/products/17437200
E2133,"Grace every event like the style star that you are with this sophisticated red number from Milano Formals 2133. This dress displays a high halter neckline and an open back. Sparkling rhinestones trimmed the lining of the bodice down to its back and lovely pool of satin train. Be unforgettable with this stunning evening gown by Milano Formals. Style: milano_E2133 Closure: Zipper Details: High Neck, Beaded Back Detail, Low Open Back, Fabric: Stretch Satin Length: Long Neckline: Halter Waistline: Natural Silhouette: Sheath Category: Long Dress Available Colors: Red Sizes: 00 Â– 18 This special occasion dress is returnable. Please refer to our special occasion dress return policy (click here) for more details..",https://www.lookmazing.com/milano-formals-beaded-halter-satin-evening-gown-e2133/products/15855710
E2078,"Look every bit a fashion vixen in this cocktail dress by Milano Formals E2078. Showcasing a fabulously cut high halter neckline and flowy chiffon skirt, this piece has a geometrically beaded crop top in wine. Its charming open back mirrors the intricacy of its bodice. Unleash your exquisite charm with this Milano Formals cocktail dress. Style: milano_E2078 Closure: Zipper Details: Halter Neckline, Geometrically Beaded Bodice, High-Waist Chiffon Skirt, Cropped Top, Beaded Waistband, Open Back, Beaded Back Straps Fabric: Chiffon Length: Short Neckline: Halter Waistline: Natural Silhouette: Flare Category: Short Dress Available Colors: Red Sizes: 00 Â– 18 This special occasion dress is returnable. Please refer to our special occasion dress return policy (click here) for more details..",https://www.lookmazing.com/milano-formals-two-piece-beaded-halter-chiffon-cocktail-dress-e2078/products/15829123
E2350,"Get glamorous look with this chic Milano Formals E2350 evening dress. This sophisticated ensemble features a fitted bodice with sleeveless cut topped by a halter neckline that is adorned with a dazzling beaded applique for a perfect touch of sparkle. The fun and flirty high low tiered skirt constructed in organza fabric finishes to a beautiful sweep train. The sheer full back is enclosed with a center zipper closure for a perfect fit. Stand out from the crowd with this magnificent Milano Formals design. Style: milano_E2350 Fabric: French Organza Closure: Zipper Details: Sleeveless, Beaded Appliqued Bodice, Tiered Skirt, Horsehair Hem, Full Sheer Back, Back Zipper Closure, Sweep Train Length: High Low Neckline: Halter Waistline: Natural Silhouette: A-Line This special occasion dress is returnable. Please refer to our special occasion dress return policy (click here) for more details..",https://www.lookmazing.com/milano-formals-e2350-beaded-applique-halter-high-low-dress/products/18418311
E2075,"Render your girlfriends speechless with this elaborately designed Milano Formals E2075 two-piece cocktail dress. Speak volumes of sassiness with this ensembleÂ’s high halter neckline, sexy crop top cut and flowy Mikado flare skirt. Its chevron patterned bodice is meticulously encrusted with dazzling beads that reflects the light at every turn. The iridescent beadwork is also mirrored on both neck and waistband details. Be fascinating from head to toe with this lovely Milano Formals cocktail dress. Style: milano_E2075 Closure: Zipper Details: Bead Encrusted, Halter Neckline, Heavily Ornate Neck and Waistbands, Cropped Top, Exposed Midriff, High-Waist Flare Skirt Fabric: Mikado Length: Short Neckline: Halter Waistline: Natural Silhouette: Flare Category: Short Dress Available Colors: Blue Sizes: 00 Â– 18 This special occasion dress is returnable. Please refer to our special occasion dress return policy (click here) for more details..",https://www.lookmazing.com/milano-formals-two-piece-beaded-crop-top-cocktail-dress-e2075/products/15829116
