Code,Color,Long Description,Short Description,Keywords,Tags,Filename
AA9349,Ivory,"This elegant bridal dress, presented in stunning ivory, features an eye-catching shoulder detail and body-flattering silhouette. The dress is complete with a delicate hair accessory, showcasing a subtle mix of fashion and tradition.","Ivory bride's dress with shoulder detail, complemented with a hair accessory for an enchanting wedding charm.","Ivory wedding dress, shoulder detail bridal gown, traditional bride's dress, bridal outfit with hair accessory.","Ivory, Dress, Bride, Wedding, Shoulder-Detail, Hair-Accessory, Traditional, Fashion, Elegant.",AA9349_Ivory_1.png
E2182,Navy,"In a regal shade of navy, this elegant one-piece day dress asserts a chic presence. The gown features thoughtful details like a tasteful neck, fitted waist, ample sleeves, and touches of violet and purple, enhanced by the sophistication of its shoulder design.","Elegantly navy, one-piece day dress with meticulous waist, neck, and shoulder design, enhanced by violet hues.","Navy dress, one-piece dress, day dress, violet day dress, elegant shoulder design, purple gown, fitted waist dress, dress with sleeve, royal navy dress.","Navy, One-piece, Day-dress, Violet, Purple, Shoulder-design, Fitted-waist, Sleeve, Gown.",E2182_Navy_1.png
E1264,Claret,"This one-piece dress is a vision of style in a vivid shade of claret. The design features a strapless bodice complemented by a waist-cinched day dress cut. Its thigh-high length is perfect for showing off legs, paired beautifully with basic pumps. The addition of short sleeves adds a touch of class to the overall aesthetic.","Elegant claret strapless day dress, cinched at the waist, thigh length, complemented by basic pumps.","Claret dress, one-piece dress, strapless day dress, cinched waist dress, thigh length dress, dress with pumps","Claret, One-piece, Strapless, Waist-cinched, Thigh-length, Pumps",E1264_Claret_1.png
E2016,Red,"This radiant red, one-piece dress is the epitome of elegance. The strapless design perfectly highlights the neck and waist. The thigh-high slit amplifies its allure, while the full-length gown silhouette makes it an ideal choice for bridal parties or classy events.","A radiant red strapless dress, showcasing elegance with a thigh-high slit and sophisticated full-length gown silhouette.","Red dress, One-piece dress, Strapless dress, Bridal party dress, Sleeveless, Full-length gown, Thigh-high slit","Red, One-piece, Dress, Strapless, Bridal, Sleeveless, Waist, Gown, Thigh",E2016_Red_1.jpg
E1974,Mint,"This mint-colored bridal party dress boasts a strapless design to show your lovely shoulders while also providing a one-piece garment ease. The day dress, cinched at the waist, highlights the human form, making it a perfect choice for any bridal function. ","Mint strapless day dress for bridal parties, enhancing the feminine figure with its one-piece design.","Mint bridal party dress, strapless day dress, one-piece bridal clothing, waist-cinching dress, shoulder-showing dress.","Mint, Strapless, One-piece, Day-dress, Bridal.",E1974_Mint_1.png
E2770,Red,"Embrace summer vibes with our vibrant red one-piece dress. Its design accentuates the shoulders and legs, while the skin-friendly fabric ensures ultimate comfort. The dress exudes an infectious smile-worthy charm, winning you compliments at every outing.","Radiant red, joyful one-piece ensemble, flaunting confident shoulders and leg lines, as comfortable as second skin.","Red Dress, One-Piece, Shoulder-show, Skin-Friendly, Summer Dress, Vibrant Attire, Compliment-Grabber.","Red, OnePiece, ShoulderRevealing, SkinFriendly, Comfortable, SummerDress, Vibrant, Compliments.",E2770_Red_1.png
E1988,RoyalBlue,"This impressive royal blue dress emanates regality. Featuring a smart one-piece design, it incorporates a considerate arm and shoulder exposure. The piece gracefully extends down the leg, providing a flattering silhouette. A sophisticated high neck adds to its eminent style.","A radiant royal blue one-piece dress. Opulent arm and shoulder show, with a refined high neck.","Royal blue dress, One piece dress, Dress with arm exposure, Shoulder show dress, High neck dress, Outerwear","RoyalBlue, OnePiece, Outerwear, ArmExposure, ShoulderShow, HighNeck, Dress",E1988_RoyalBlue_1.png
E1967,Teal,"This elegant Teal dress flaunts a day dress style suitable for any outdoor occasion. It clings gently, emphasizing the human body's curves with a tasteful neck and sleeve design. The color, reminiscent of a clear azure sky, adds a touch of vivacity.","A chic Teal day dress, beautifully reflecting the azure sky with a flattering silhouette.","Teal Dress, Day Dress, Sky-colored Dress, Azure, Comfortable, Outdoor, Casual, Party Wear","Teal, Day-Dress, Outdoor, Casual, Party-Wear, Azure, Comfortable, Neck-Design, Sleeve-Design",E1967_Teal_1.png
E2256,Royal,"This royal-colored dress is a showstopper piece with its dreamy azure hue. The elegant one-piece garment aligns style with comfort. The dress flaunts a day dress style, accentuating the neck and arms, perfect for flaunting any hairstyle and highlighting the beauty of the legs.","Elegant azure royal dress, highlighting the arms and neck, ideal for any hairstyle. Comfort meets style in a one-piece ensemble.","Royal dress, Azure dress, Elegant day dress, One-piece garment, Hairstyle-friendly dress, Arm-highlighting dress, Neck-enhancing dress","Royal, Azure, One-piece, Day dress, Hairstyle-friendly, Arm-highlighting, Neck-enhancing",E2256_Royal_1.png
E2786,Purple,"This is a vibrant, purple one-piece dress that beautifully highlights your contours. It features an alluring neckline design drawing attention to the shoulders and waist, while extending to an elegant arm coverage.","Graceful, one-piece purple dress with a flattering cut emphasizing the shoulders, waist, and arms. Perfect for any elegant occasion.","Purple Dress, Elegant One-Piece, Flattering Waistline, Accentuated Shoulder Design, Arm Coverage Dress","Purple, Dress, One-Piece, Waistline, Shoulders, Arms",E2786_Purple_1.png
E1637,BlackNude,"This elegant one-piece dress in chic BlackNude displays a statement of class. It accentuates the waist and neck, with a day dress cut that gracefully extends into a bridal party gown reaching the thigh.","An elegant BlackNude one-piece, complete with bridal-party-worthy allure – a striking display of grace and sophistication.","BlackNude Dress, One piece garment, Day Dress, Bridal Party Gown, Chic Arm and Neck Design, Waist Emphasizing Dress, Thigh Length Dress","BlackNude, One-Piece, Day-Dress, Bridal-Party, Gown, Thigh-Length, Waist-Accentuating, Graceful, Sophisticated",E1637_BlackNude_1.png
E2426,Navy,"This Navy-colored, one-piece dress is ultimately divine. The dress features a flattering bow on its waist, romantic sleeves extending to the elbows, and a graceful neck design. The color and elegant style make it suitable for beautiful events such as bridal parties but also ideal for everyday wear. Perfect for the woman who demands comfort without compromising style.","Navy dress combines style and elegance, with flattering bow waist, romantic sleeves, and graceful neck design.","Navy one-piece dress, Bow waist dress, Elbow-length sleeves dress, Elegant neck dress, Bridal party dress, Everyday wear gown.","Navy, One-piece, Outerwear, Dress, Bridal-party, Day-dress, Gown, Sleeve, Waist, Elbow-length, Graceful-neck.",E2426_Navy_1.jpg
E2774,Black,"This elegant black dress is a perfect blend of style and comfort. Designed with graceful lines that beautifully frame the shoulder and neck, it features an open arm design for a touch of bold femininity. The day dress is made of elite textile, ensuring a soft, complementing fit for any occasion. ","Elegant black day dress, showcasing open arm design and finely crafted shoulder and neck lines. ","Black dress, Open arm dress, Elegant day dress, Textile dress, Shoulder frame dress","Black, day dress, open-arm, shoulder-frame, textile",E2774_Black_1.png
E1270 ,Coral,"This is a stunning coral one-piece dress, designed to highlight your natural grace. The dress accentuates the hair, skin, and joints, features a flattering cut that fits perfectly around the head, shoulder, arm, and leg. ","Coral dress glorifies natural beauty, perfect fit for your every move. A must-own.","Coral Dress, One-Piece Dress, Perfect Fit Dress, Graceful Dress, Joint-Enhancing Dress","Coral, One-Piece, Graceful, Perfect-Fit, Joint-Enhancing",E1270 _Coral_1.png
E2570,Burgundy,"This magnificent burgundy one-piece day dress is perfect for a chic, polished look. The outerwear features a tastefully embellished waist that cinches to highlight your figure. Its long sleeves, perfectly tailored neck, and rich purple tinge offer a blend of elegance and comfort.","Elegantly tailored burgundy dress, ideal for daywear. Features a cinched waist, long sleeves and tasteful embellishments. ","Burgundy dress, One-piece garment, Day dress, Embellished waist, Purple dress, Arm sleeve dress, Outerwear, Neckline dress","Burgundy, One-piece, Outerwear, Long-sleeve, Day-dress, Waist, Purple, Embellishment",E2570_Burgundy_1.png
E2509,Red,"This vibrant red one-piece garment is a blend of elegance and style. Featuring a flattering joint design, its unique hairstyle print adds an extra shine to the dress. The exposed shoulder and neck give a hint of sophistication, while the smile pattern on the dress adds a fun element. The leg-revealing dress perfectly caters to flash photography.","Radiant red dress with artistic hairstyle print, exposed shoulder and leg-revealing cut, perfect for flash photography.","Red dress, one-piece garment, hairstyle print, shoulder reveal, leg-revealing, flash photography, smile pattern, joint design.","Red, One-piece, Hairstyle, Shoulder, Smile, Leg, Neck, FlashPhotography.",E2509_Red_1.png
E2614,Navy Blue,"The E2614 is a graceful navy blue dress that hugs your waist, draping elegantly off your shoulder and down to your thighs. The well-crafted, jointed design pays special attention to the neck, waist and thigh regions, presenting a lovely representation of fashionable sophistication.","Navy blue, waist-embracing dress with joint design on shoulder, neck and thighs exudes sultry sophistication","Navy Blue Dress, Shoulder Joint Design, Waist Fitting Dress, Sophisticated Dress, E2614 Dress.","Navy, Dress, Fashion, Sophisticated, Shoulder, Neck, Waist, Thigh, Jointed.",E2614_Navy Blue_1.png
E2125,Navy,"This elegant one-piece navy gown is the epitome of timeless sophistication. The dress features a flattering waist, comfortable arms, and a neckline that adds a touch of glamour to the wearer. Perfect for day-to-day elegance or special occasions. Offers an exceptional fit that highlights the human body's natural contours. ","Classic navy gown—flattering waistline, modest neckline. Boasts day-to-day sophistication and special occasion elegance.","Navy gown, One-piece dress, Day dress, Elegant dress, Waist flattering dress, Shoulder show dress, Special occasion gown, Comfortable dress, Human body complimenting gown, Sophisticated gown.","Navy, One-piece, Day-Dress, Waist-Flattering, Occasion, Elegant, Comfortable, Sophisticated, Gown.",E2125_Navy_1.png
E1796,Ivory,"This is a luxurious Ivory wedding dress made with intricate detailing. The dress features a trendy shoulder-baring style and a flattering fit. The accompanying hairstyle perfectly complements the one-piece garment, ideal for your special day, enhancing your elegance and grace.","Luxurious Ivory wedding dress, shoulder-baring style, perfect for ultimate elegance on your special day. ","Ivory wedding dress, Shoulder baring, One-piece wedding dress, Elegant wedding dress, special day dress.","Ivory, Wedding, Dress, One-piece, Elegant, Hairstyle, Shoulder-baring.",E1796_Ivory_1.png
E1340 ,Coral,"This exquisite Coral color one-piece garment features a classy day dress style, suitable for bridal party occasions. The luxurious piece carefully contours the human body emphasizing the arm, leg, and joint intricacies. The highlight of the ensemble is how it effortlessly meshes with the wearer's hair, creating a harmonious visual appeal.","Elegant coral day dress, embodying delicate femininity. Ideal for bridal parties. Contours body beautifully.","Coral day dress, One-piece garment, Bridal party dress, Elegantly contours body, Designed to highlight hair","Coral, One-piece, Day-dress, Bridal-party, Contours, Hair-highlight",E1340 _Coral_1.png
E1022,Purple,"A radiant purple strapless dress that accentuates the wearer's shoulders and neck. Its one-piece design features a comfortably snug fit that promotes an elegant silhouette. The dress exudes joy, evident in the wearer's smile, making it the perfect outfit for special occasions.","Stylishly vibrant purple strapless dress, perfect for a confident, joyful presentation. ","Strapless dress, Purple dress, Party dress, Elegant dress, One-piece dress, Comfort fit ","Purple, Strapless, Dress, Elegant, One-piece, Comfort-Fit",E1022_Purple_1.png
AA9322,White-Ivory,"This gorgeous White-Ivory wedding dress is designed with articulate elegance. Its shoulder-revealing cut complements a fashionable hairstyle, while the majestic bridal gown lends an air of timelessness to the bridal party. The flash photography accentuates the dress's sophisticated charm and captures the neck detailing in an ethereal light.","Exquisite White-Ivory wedding dress, shoulder-revealing, complimenting hairstyles, timeless bridal party gown.","Wedding dress, White-Ivory, Hairstyle compatible, Shoulder cut, Bridal clothing, Bride dress, Bridal party dress, Elegant gown, Flash photography friendly, Neck detailing.","Wedding, White-Ivory, Hairstyle, Shoulder, Bridal, Dress, Party, Gown, Photography, Neck.",AA9322_White-Ivory_1.png
E1472,Royal,This elegant royal-colored dress is designed with sophistication and comfort in mind. It features a flattering one-piece silhouette that enhances the contour of your body. The dress gracefully falls on your limbs and features a neat collar at the neckline. ,"Cozy, majestic one-piece royal dress, perfectly tailored to flatter your silhouette and style.","Royal dress, One-piece dress, Elegant clothing, Comfortable costume, Neckline collar outfit, Sophisticated attire, Style silhouette.","Royal, One-piece, Dress, Elegant, Comfortable, Collar, Sophisticated.",E1472_Royal_1.png
E2041,Ivory,"An elegant one-piece Ivory sheath dress, perfect for daytime glamour. This enviously-styled dress features outerwear suitable for transitioning climates, a refined silhouette that complements the arm's length. Finish the look with your beautiful hair to stun at any social event.","Ivory sheath day dress, slender fit, artful arm-length, apt for versatile outerwear.","Ivory dress, Sheath dress, One-piece dress, Day dress, Elegant outerwear, Arm-length dress, Versatile dress.","Ivory, Sheath, OnePiece, DayDress, Outerwear, ArmLength.",E2041_Ivory_1.png
E1502,Claret,"This elegant claret one-piece dress boasts a flattering strapless design and chic silhouette. It elegantly embraces the body, accentuating the waist, leg, and thigh. Ideal as a bridal party dress or day dress.",Chic claret strapless piece; ideal for bridal parties or day events; embraces body curves beautifully.,"Claret dress, Strapless dress, One-piece dress, Bridal party dress, Day dress, Body-hugging dress, Elegant dress.","Claret, One-piece, Dress, Bridal-party, Day-dress, Strapless, Sleeveless, Waist-emphasizing, Thigh-accentuating.",E1502_Claret_1.png
E2322,Teal,"This sophisticated teal one-piece dress is a visual delight. Designed with an elegant waist and sleeve details, it features a tastefully styled neck. The dress flows into a day-ready gown with a purple shade hint, adding to its allure. ","Captivating teal one-piece dress, effortlessly transitions from day to gown, with chic waist and sleeve details.","One-piece dress, Teal dress, Day dress, Classy gown, Elegant sleeves, Fashionable neckline, Waist detail, Purple hints.","Teal, One-piece, Day-dress, Gown, Chic, Elegant, Classy, Azure, Purple.",E2322_Teal_1.png
E1822,Peach,"Presenting a breathtaking peach bridal party dress in a one-piece design. The dress features a delicate neckline, alluring shoulder cut, and graceful sleeves. It fabulously showcases the wearer's hair, head, neck, and legs, ensuring a standout look.","Captivating peach-toned bridal party dress, showcasing elegance in a sleek one-piece garment.","Peach Bridal Dress, One-piece Party Garment, Elegant Sleeve Dress, Shoulder Cut Dress, Bridal Party Dress.","Peach, One-piece, Bridal, Party-Dress, Elegance, Sleeve, Shoulder-Cut, Neckline.",E1822_Peach_1.png
AA9270,White-Ivory,"This breathtaking white-ivory wedding dress features a strapless design that elegantly showcases the bride's shoulders and arms. The hairpiece complements the exquisite gown, styled as a one-piece garment. It's the perfect attire for creating timeless bridal memories.",Classic strapless white-ivory wedding dress. Timeless elegance for the most unforgettable moment.,"Strapless wedding dress, Ivory bridal gown, One-piece bridal dress, Elegant wedding dress, Bridal hairpiece","White, Ivory, Wedding, Strapless, One-piece, Elegant",AA9270_White-Ivory_1.png
E1452,Lilac,"This dress is a beautiful lilac sheath dress, a one-piece garment that gracefully contours the body. The dress features a elegant simplicity, highlighting the legs, arms, and shoulder area. Perfect for a stylish, modern look.",An elegant lilac sheath dress. Gracefully contours the body enhancing natural beauty and charm.,"Lilac dress, sheath dress, one-piece dress, elegant dress, modern dress, body contour dress","Lilac, Sheath, One-piece, Modern, Elegant, Dress",E1452_Lilac_1.png
E1907,Charcoal,"This stunning charcoal dress strikes a captivating silhouette with its one-piece garment design. It supreme elegance with details such as a defined waist, flowing gown, and tasteful thigh exposure. The hairstyle and arm silhouette are elegantly complemented, proving it to be a standout day dress for any occasion.","A captivating charcoal gown featuring a classy one-piece design, defined waist, and tasteful thigh exposure.","Charcoal dress, One-piece gown, Day dress, Elegant gown, Waist accentuating dress, Thigh-exposing dress.","Charcoal, One-piece, Day-dress, Gown, Thigh-exposure, Waist-defined.",E1907_Charcoal_1.png
E2318,Blue,"This stunning azure blue dress combines elegance and style in a one-piece garment. The dress features a flattering waist and chic neck and shoulder design, making it an ideal choice for any daytime occasion. Its color is reminiscent of the clear daytime sky, perfectly capturing a sense of sophistication and grace.","A breathtaking azure blue day dress flaunting chic shoulder and neck detailing for a refined, elegant look.","Blue Dress, Azure Dress, Day Dress, One-piece Garment, Waist Detailing, Shoulder Detailing, Elegant Clothing, Daytime Style.","Blue, Dress, One-piece, Waist, Shoulder, Azure, Day-Dress, Elegance",E2318_Blue_1.png
E1381,Purple,"This is a stunning purple strapless dress which elegantly sits on your curves. Made for evenings, it features a single-piece design with a comfortable joint for easy movement. Its uniqueness lies in its beautiful arm design, making a wearer don a cheerful smile.","Glamorous purple strapless dress, perfect for evening wear, combines comfort with chic, showing off a joyous character.","Purple evening dress, strapless dress, one-piece garment, comfortable joint, outerwear, smiling dress.","Purple, Evening, Strapless, One-piece, Comfortable, Outerwear, Smile.",E1381_Purple_1.png
E2708,Navy,"This one-piece Navy dress exhibits elegance and charm, perfectly designed for daytime occasions. It features a flattering shoulder display, a classy neck cut, and a unique shade of azure and purple. Perfect for bridal parties.",Elegantly cut Navy dress with shoulder detail. Ideal for daytime soirees and bridal party wear.,"Navy dress, Day dress, One-piece garment, Bridal party outfits, Azure and purple dress, Shoulder cut dress.","Navy, One-piece, Day-dress, Azure, Purple, Bridal-party, Shoulder-detail.",E2708_Navy_1.png
E2701,Rose,"Exuding a regal charm, this rose-colored wedding dress aptly portrays a harmonious blend of tradition and modernity. It enhances the aesthetics with delicate details, a flowing one-piece design, and an air of timeless elegance.","A rose-hued wedding dress, exuding timeless elegance with a refined blend of traditional and modern aesthetics.","Rose wedding dress, Bridal one-piece, Elegant wedding dress, Modern Bridal gown, Traditional wedding attire, Delicate detailing, Smile-enhancing dress, Shoulder-baring gown.","Rose, Elegant, Bridal, One-piece, Wedding dress, Traditional, Modern, Delicate-detailing.",E2701_Rose_1.png
E1663,Fuchsia,"An alluring fuchsia dress that stands out with its unique one-piece construction. This vibrant dress features long sleeves, a clinched waist, and a day dress length. It pairs excellently with stylish footwear, making it ideal for any occasion.","Vibrant Fuchsia Day Dress with an elegant waist clinching design, perfect for standout elegance.","Fuchsia dress, One-piece dress, Long Sleeve dress, Day dress, Dress with waist, Dress to pair with shoes.","Fuchsia, One-piece, Long sleeve, Day-Dress, Waist, Shoe-pairable.",E1663_Fuchsia_1.png
AA9316,White-Ivory,"This luxurious White-Ivory wedding dress features exquisite embellishment around the neck and waist. The one-piece garment flows gracefully down, creating a stunning silhouette catered for the elegant bride. To ensure lasting charm, it is captured beautifully under flash photography.","Luxurious White-Ivory wedding dress with refined embellishments, creating a beautiful silhouette for the elegant bride.","Bridal dress, White-Ivory wedding dress, Bridal party dress, Wedding dress with embellishments, One-piece wedding dress, Elegant bridal gown, Classy wedding dress, Ivory bridal gown. ","Bridal, Dress, White-Ivory, One-piece, Embellishments, Wedding, Photography, Flash, Waist, Neck.",AA9316_White-Ivory_1.png
E1285,Cafe,"This is a beautiful Cafe colored one-piece day dress. Its design features a flattering strapless ensemble, a cinched waist, and a perfectly tailored sleeve that complements any arm. It showcases an elegant neck design and brings joy with its charming smile motif, making it an ideal choice for a bridal party dress. ","A strapless Cafe-colored day dress with an elegant waistline, perfect for bridal parties. ","Strapless dress, one-piece dress, Cafe colored dress, bridal party dress, day dress","Strapless, One-Piece, Cafe, Bridal Party, Day Dress",E1285_Cafe_1.png
E2535,Burgundy,"This elegant Burgundy dress features a flattering one-piece design that highlights the shoulders and legs. Its exquisite hairstyle, joint, and smile patterns add a charming touch, accentuated by unique plant accents. A perfect blend of comfort and style, this dress is a must-have for any wardrobe.","A Burgundy one-piece dress; distinct hairstyle, joint, and smile accents; plant motifs; elegant shoulder and leg exposure.","Burgundy dress, one-piece dress, plant motif dress, shoulder-exposing dress, leg-highlighting dress, hairstyle patterned dress, comfortable stylish dress.","Burgundy, One-Piece, Plant-Motif, Shoulder-Exposure, Leg-Highlight, Hairstyle-Pattern, Comfortable, Stylish.",E2535_Burgundy_1.png
E2615,Claret,"In a striking claret color, this lavish one-piece garment embraces femininity with its shoulder and arm showcase. Detailed with a joint head, lip, and eyelash accent on the neckline, it's exquisitely designed for those looking for a balance between sophistication and style.","Claret one-piece, artfully detailed with body features, evoking chic elegance with a modern edge. ","Claret Dress, One-Piece Garment, Feminine Dress, Shoulder Showcase Dress, Chic Elegance Dress, Modern One-Piece, Detailed Neckline Dress, Lip and Eyelash Accents.","Claret, One-Piece, Feminine, Shoulder Showcase, Chic, Elegance, Detailed Neckline, Lip Detail, Eyelash Detail.",E2615_Claret_1.png
E2428,Navy,"Make a statement with this navy one-piece garment. The dress has been designed to accentuate the natural contours of the human body, featuring a flattering waist, sleeve and thigh fit. You'll love the ease of this piece, perfect for an array of social outings and formal events. ","Captivating navy dress, highlighting natural curves, offering sophisticated elegance & comfort for all occasions.","Navy dress, One-piece outfit, Body-contoured dress, Formal occasion dress, Sleeve and waist detailing, Sophisticated comfort.","Navy, One-piece, Waist-detail, Sleeve-detail, Thigh-fit, Elegant, Comfortable.",E2428_Navy_1.png
E2204,Black,"This is a stylish black one-piece dress that gracefully contours the body. It features a strapless neckline, thigh-length hem, and a cinched waist for an elegant silhouette. The dress is crafted for comfort with its soft sleeve and simple yet chic day dress style.    ","Elegantly designed black strapless dress, perfect for day wear, flattering silhouette with cinched waist.","Black dress, One-piece outfit, Strapless dress, Day dress, Thigh-length dress, Casual dress, Chic dress, Comfortable dress, Strapless black day dress, Waist-cinching dress.","Black, Strapless, One-piece, Thigh-length, Day-dress, Waist-cinching, Casual, Chic.",E2204_Black_1.png
