Code,Color,Long Description,Short Description,Keywords,Tags,Filename
E2526,Green,"Spruce up your wardrobe with this chic one-piece day dress in an appealing shade of green. Crafted for comfort and style, it features a well-defined waistline, modest neck cut and knee-high length. Its azure and aqua undertones give it a delightful and unique appearance. Wear it with a smile - the perfect footwear pairing.","Chic, green one-piece day dress - vivid, unique undertones. Pair with a radiant smile and your favorite footwear.","Green day dress, one-piece dress, knee-high dress, azure undertones, aqua undertones, dress with waistline, modest neck dress, dress with thigh coverage.","Green, One-Piece, Day-Dress, Azure, Aqua, Knee-Length, Waistline, Neck-Coverage, Thigh-Coverage.",E2526_Green_1.png
E2158,Gold,"A luxurious one-piece wedding dress in a striking gold color. This dress boasts a captivating design, featuring an elegant shoulder-bearing cut, an attractive neckline, and sleeve detailing. Its chic day-dress style sends a statement in any bridal party, imbuing the wearer with an undeniable grace. The dress is crafted from a high-quality textile, ensuring both style and comfort.","Luxurious gold, one-piece wedding dress. Elegantly showcases shoulder and neck, with stylish sleeve details. ","Gold wedding dress, One-piece dress, Wedding dress with sleeves, Shoulder-bearing wedding dress, Day dress, High-quality textile dress, Bridal party dress","Gold, One-piece, Wedding, Sleeve, Textile, Day-dress, Bridal-party",E2158_Gold_1.png
E2081,Navy,"This is a graceful navy sheath dress that hugs the contours of your body, highlighting your silhouette elegantly. It features a sophisticated one-piece design, perfect for day wear. Its simple neckline emphasizes the wearer's neck, further adding to the dress's chic appeal.","Elegant navy sheath dress, beautifully contouring, perfect for day wear, highlighting neck and leg features.","Navy sheath dress, One-piece dress, Day wear, Elegant dress, Dress for highlighting neck and legs.","Navy, Sheath, Daywear, One-piece, Elegance",E2081_Navy_1.jpg
E2589,Black,"This is an elegantly designed, one-piece black dress perfect for any bridal party. The strapless dress accentuates the neck, shoulder and hair — adding a touch of class to any occasion. Its superior cut and fit promise comfort all day long.","Elegantly refined black dress, perfect for bridal parties, designed to elegantly highlight neck, shoulder, and hair.","Black Bridal party dress, One-piece dress, Strapless dress, Black dress, Day dress","Black, Bridal, Strapless, One-piece, Day-dress, Comfort",E2589_Black_1.png
E2385,Black-Gold,"This striking black-gold dress is an epitome of exquisite fashion design. It features a one-piece garment style with a beautifully cinched waist, delivering a royal appeal. The dress has a distinguished neck style and cozy sleeves, exuding irresistible charm. Best suited as a day dress, it can be a magnificent addition to your wardrobe.","Exquisite black-gold dress with a defined waist, regal neck design, and comfy sleeves, perfect for day-time elegance.","Black-Gold Dress, Day Dress, One-piece Garment, Fashionable Gown, Dress with Sleeve, Regal Neck Design.","Black, Gold, Day-Dress, One-piece, Sleeve, Waist, Gown, Hair, Outerwear, Fashion-Design.",E2385_Black-Gold_1.jpg
E1581,Purple,"A unique, purple one-piece garment designed for a dazzling appearance. This dress features a flattering silhouette accentuating the shoulder, arm, neck, and leg region. Accented by a head-turning hair piece, it communicates an effortless elegance while promising undeniable comfort. It's adorned with a heart-warming smile design, ensuring that you bring joy wherever you go. Bundled with a joint area that offers flexibility suitable for any event.","Dazzle in this unique purple one-piece dress. Enhanced for elegance, comfort, and flexibility, adorned with smile design.","Purple dress, one-piece dress, comfortable dress, elegant dress, smile design dress, joint flexibility dress, hairstyle dress.","Purple, One-piece, dress, arm, shoulder, joint, head, hair, smile, leg, neck, comfortable, elegant.",E1581_Purple_1.png
E2251,Biscotti,"A stylized one-piece day dress in a sophisticated biscotti hue. This dress features a flattering waist cut, a neck design and a touch of flash photography. The outerwear is additionally adorned with hair and eyewear elements that extend down the arm.","A biscotti-colored day dress with hair and eyewear accents, waist cinch design, and flash-inspired detailing.","Biscotti dress, Day dress, Waist design, One-piece garment, Hair element, Eyewear element, Outerwear, Flash detailing, Arm detail","Biscotti, DayDress, OnePiece, WaistCut, Hair, Eyewear, Outerwear, FlashPhotography, ArmDetail",E2251_Biscotti_1.png
E2534,Navy,"This elegant and sophisticated navy dress is designed for unforgettable moments. The dress showcases a flattering waistline, draped sleeves, and a neat neck cut, all accentuated with a hint of flash photography. ","Graceful navy dress featuring draped sleeves, waist accents, and a radiant smile guarantee. ","Navy dress, Face highlight, Shoulder design, Smile detailing, One-piece garment, Azure, Neck cut, Waist accentuation, Sleeve aesthetics, Flash photography dress","Navy, Face, Shoulder, Smile, One-piece, Azure, Neck, Dress, Waist, Sleeve, Flash",E2534_Navy_1.png
E2317,Navy,N/A,N/A,N/A,N/A,E2317_Navy_1.png
E1520,Sangria,"This stunning Sangria-colored dress comes with a trendy one-piece design that wows at all angles. Luxe in hue, it features a flattering waist and an alluring neckline, accentuated with hair that falls freely over the shoulders and arm, giving it a strikingly feminine touch. Perfect for day dress occasions, it is designed to match any joint event.","A voguish Sangria day dress, featuring an enticing waist, shoulder-baring neckline and complemented by freely-falling hair.","Sangria-colored dress, one-piece outfit, shoulder dress, day dress, feminine dress, arm-revealing dress, hair fall design, flattering waist, purple day dress.","Sangria, One-piece, Hair-design, Day-dress, Waist, Shoulders, Arm, Purple, Feminine, Joint-event.",E1520_Sangria_1.png
E2088,Pink,"A luscious pink one-piece dress that exudes elegance and charm. It features a beautifully fitted body, embracing the shoulder and arms gracefully, flowing into an airy skirt that falls perfectly over the leg. This garment is complemented by pink footwear, culminating in an ensemble that is the epitome of feminine allure.","Eloquently tailored elegance in pink. A one-piece dress with a fitted bodice and flowy skirt, accompanied with matching footwear.","Pink Dress, One-piece dress, Feminine wear, Arm and shoulder fashioned dress, Elegant ensemble, Pink Shoe, Pink Footwear.","Pink, Dress, One-piece, Footwear, Elegant, Feminine, Clothing, Outerwear.",E2088_Pink_1.png
E2356,Black-Print,This is a stylish black-print day dress designed for comfort and fashion. The dress enhances the waistline and features sleeves that are perfect for any setting. Its neck design adds a touch of glamour while the one-piece design ensures ease of dressing.,"Black-print day dress, defined waistline, comfortable yet chic, perfect for any occasion.","Black Day Dress, One-Piece Garment, Comfortable Dress, Waistline Dress, Sleeve Dress, Chic Dress, Neck Design Dress","Black, One-piece, Comfort, Waistline, Sleeve, Chic, Neck-Design",E2356_Black-Print_1.jpg
E1868,Champagne,"This hair-joint-champagne colored dress features a one-piece design that exudes elegance. With chic details accentuating the skin, head, hand, shoulder, arm, and neck, it's the ideal statement piece.","Elegance personified in sparkly champagne, this single-piece dress elegantly adorns you from head to ankle.","Champagne Dress, One-Piece Dress, Elegant dress, Full-length dress, Joint details, Shoulder accentuation","Champagne, One-piece, Dress, Full-length, Elegant, Joint-details, Shoulder-accentuation",E1868_Champagne_1.png
E2326,Black-Red,"An exquisite black-red one-piece dress that embraces modern fashion design. This day dress highlights a defined waist and thigh length, with a sleeve addition, perfect for flash photography settings. Despite its image label stating purple, the garment's main color is black-red, set to complement dark hair beautifully.","Modern black-red day dress, waist defined, thigh-length, sleeves included. Perfectly contrasts with black hair.","One-piece dress, black-red dress, fashion design, waist-fitting, thigh-length, sleeve, day dress, flash photography outfit.","One-piece, Dress, Black-Red, Sleeve, Waist, Thigh, Day-Dress, Fashion-Design, Black-Hair",E2326_Black-Red_1.png
E1986,Tiffany,"The alluring Tiffany one-piece dress is a wardrobe necessity designed for the style-conscious woman. It displays a high neckline, wide shoulder exposure, and a contoured waist, which conveys a blend of sophistication and glamour. The dress's highlights are its unique sleeve design and an adjustable waistline, accentuating the leg line and adding to its charm. It's an excellent choice for day events to flaunt your fashion-forward personality.","Chic Tiffany day dress - showcasing a high neckline, wide shoulder exposure, and adjustable waist - for a stylish everyday look.","Tiffany one-piece dress, high neckline dress, neoteric sleeve day dress, refined waist dress, leg line accentuating dress, stylish everyday dress","Tiffany, One-piece, Shoulder-exposed, High-neck, Contoured-waist, Sleeve-design, Day-dress.",E1986_Tiffany_1.png
E1882,Royal,"Show off your effortless style in our royal blue dress. This ethereal piece features a flattering one-piece design that highlights your shoulder and leg, complemented by an eye-catching hairstyle. It skims gently over the skin and joints, promoting comfort and ease of movement. ","Unleash your inner royal with this ethereal blue dress, featuring a flattering silhouette.","Royal blue dress, one-piece garment, eye-catching hairstyle, comfortable dress, dress for all occasions.","Hair, Joint, Skin, Head, Hairstyle, One-piece garment, Eye, Shoulder, Dress, Leg, Royal.",E1882_Royal_1.png
E2114,Royal-Blue,This stunning royal-blue one-piece dress will add an elegant charm to your look. It's designed to highlight the shoulder and arm area while the smile-inducing fits enhance comfort. The azure shade makes it perfect for any occasion.,"Exquisite royal-blue dress for instant elegance and charm. Tailored to flatter, with comfort and azure radiance.","Royal-blue dress, One-piece dress, Shoulder-highlighting dress, Comfort-fit dress, Azure blue, Elegant blue dress, Smile inducing dress.","Blue, One-piece, Comfort-fit, Shoulder-cut, Azure, Elegance, Smile-inducing.",E2114_Royal-Blue_1.png
E1344,Yellow,"This sun-kissed yellow dress is a quintessential item for your summer collection. This dress boasts an elegant strapless design, hugging your waist before flowing out at the bottom. Styled as a day dress, it is perfect for both relaxed and semi-formal events. The unique one-piece garment adds a touch of sophistication and also allows for versatility.","Sunny yellow strapless day dress, featuring a stylish waist accentuation and free-flowing design. Perfect for summer charm.","Yellow Dress, Summer Dress, Strapless Dress, Day dress, One-piece Garment, Hairstyle focus.","Yellow, Strapless, Day Dress, One-Piece, Waist-Focused, Hairstyle-Compatible.",E1344_Yellow_1.png
E2320,Multi,"This stunning, multi-colored dress is a lovely piece that features a beautiful hair embellishment. It's more than just an outfit - it's a one-piece garment that doubles as outerwear. The arm and leg portions of the dress are delightfully designed with great attention to detail. Its bridal party dress style is perfect for special occasions, while the day dress aspect makes it suitable for less formal events as well. The smile-inducing embellishments add a unique appeal to this dress.","Anatomy-inspired, multi-colored dress with smile-inducing embellishments perfect for both formal parties and casual get-togethers.","Multi-colored dress, One-piece garment, Hair embellishment, Outerwear dress, Arm-detail dress, Leg-detail dress, Bridal party dress, Day dress, Embellished dress, Smile design.","Multi-color, One-piece, Outerwear, Arm-detail, Leg-detail, Bridal, Day-Dress, Embellished.",E2320_Multi_1.png
E2165,Fuchsia,"This striking Fuchsia dress is a charming day dress, designed to accentuate the waist. It features a regal purple hue, full-length arm coverage, and an irresistible smile-enhancing style that elegantly displays the neck and shoulders. Its one-piece garment design screams sophistication, all while keeping you effortlessly chic throughout the day.","An eye-catching Fuchsia day dress with a waist-emphasizing fit, full-arm cover, and a neck-showcasing design. ","Fuchsia dress, One-piece dress, Waist-emphasizing dress, Day dress, Full arm dress, Purple dress, Dress with neck design. ","Fuchsia, One-piece, Arm, Shoulder, Smile, Dress, Neck, Purple, Day-dress, Waist.",E2165_Fuchsia_1.png
AA9326,White-Ivory,"This exquisite white-ivory wedding dress is designed to perfection, encapsulating the essence of elegance and grace. Beautifully tailored, it features a refined waist, a stunning bridal veil and delicate gesture that complements the bridal party attire. The dress is direct evidence of the beauty of sartorial art, captured wonderfully with flash photography.","Elegant white-ivory bridal gown radiating timeless grace, complemented by a mesmerizing veil and defined waist.","White wedding dress, Bridal party dress, Ivory bridal gown, Bridal veil, Flash photography, Fashion bridal clothing.","White, Ivory, Wedding, Bride, Dress, Bridal-clothing, Bridal-party-dress, Flash-photography, Fashion, Waist, Bridal-veil, Gesture.",AA9326_White-Ivory_1.png
E2403,Silver,"Emanate elegance and grace with our Silver Day dress. A one-piece outerwear gown, it features a detailed waist and neck design. The elongated sleeves and intricate fashion design put a modern twist on this traditional day dress. Perfect for capturing the attention of every room you walk into. ","Silver Day Dress, one-piece elegant gown with distinctive neck, waist design. Ideal for every glamorous occasion.","Silver Day Dress, Outerwear gown, One-piece garment, Fashionable neck design, Detailed waist dress, Elegance gown, Modern Day dress, Intricate fashion design.","Silver, Long, One-piece, Elegant, NeckDesign, WaistDesign, DayDress, Outerwear, Gown.",E2403_Silver_1.jpg
E2031,Black,"This stunning black sheath dress is a one-of-a-kind piece, perfect for any occasion. The design flaunts a tasteful neck and waist, complimented by elegant sleeves, giving it a day dress appeal. Accented by unique hand gestures and hair, it offers a perfect blend of style and comfort.",Classic yet stylish black sheath dress accentuated by a defined neck and waist. Ideal day dress.,"Black Dress, Sheath Dress, One-Piece Garment, Day Dress, Dress with Sleeves, Elegant Dress, Waist Accentuated Dress","Black, Sheath, Dress, Sleeves, Waist, Day-Dress, One-Piece",E2031_Black_1.png
E2389,Purple,"Embrace the elegance in this stunning purple one-piece dress. Featuring a flattering waist design, sleek shoulder cut, alluring neck, and thigh-length style. Its aesthetic appeal is punctuated by the charismatic purple hue and its attractive day dress style.","Elegant purple day-dress featuring a sleek shoulder cut and flattering waist design, perfect for casual days out.","Purple day dress, Flattering waist dress, One-piece dress, Elegant shoulder cut, Thigh-length dress.","Purple, One-piece, Day-dress, Elegant, Shoulder-cut, Waist-design, Thigh-length.",E2389_Purple_1.jpg
E2514,Emerald,"This enticing emerald dress makes a bold statement with its one-piece design, highlighting the waist and thigh area. Accentuated with azure accents, it features a graceful neckline, elegant sleeves, and a comfortable shoulder joint. The day dress is suitable for standing occasions and adds a touch of class wherever worn.","Elegant emerald day dress with azure accents, chic neckline, and a flattering silhouette fitting for standing events.","Emerald day dress, One-piece dress, Azure accents, Comfortable shoulder joint, Chic neckline, Waist-accentuating dress.","Emerald, One-piece, Azure, Neckline, Sleeve, Standing, Day-dress, Waist, Thigh, Shoulder.",E2514_Emerald_1.png
AA221,White-Ivory,"This wedding dress, in elegant white-ivory, features a strapless design that reveals the collarbone area beautifully. Meticulously designed with a full Bridal party dress, it is embellished with details drawn from planting aesthetic. The bridal veil adds a final touch of sophistication, making you the center of attention.","White-Ivory strapless wedding dress with plant-inspired embellishments, a stylish bridal party dress design with a matching veil.","Strapless Wedding Dress, White Ivory Dress, Bridal Party Dress, Bridal Veil, Wedding Dress with Plants","White, Ivory, Strapless, Dress, Wedding, Bridal, Veil, Plant, Embellishment",AA221_White-Ivory_1.png
E1730,Royal,"This exquisite dress in royal color is a single-piece outfit that perfectly flatters the body. It is designed with a fitted waistline to accentuate the figure, extending to a thigh-length skirt. It features a tasteful neckline and sleeves, making it a go-to choice for both casual and formal affairs.","Royal colored dress, fitted waistline, flattering thigh-length skirt, versatile neckline, and ample sleeves.","Royal color dress, One-piece dress, Dress for formal events, Day dress, Thigh length dress, Waist accentuating dress, Dress with sleeves.","Royal, One-piece, Casual, Formal, Sleeve, Thigh-length, Waistline",E1730_Royal_1.png
E2551,Red,"This striking red one-piece day dress captivates with a bright, yet warm, orange under-hue. It elegantly outlines the waist, extends to the knee revealing a dash of thigh, and features a vivacious smile pattern. Its stylish sleeves add a charming finish to the ensemble.","Radiant, red-orange day dress with dynamic smile design highlighting the waist and knee-length.","Red day dress, Orange hue, Knee-length dress, Smile pattern, One-piece garment, Waist-accentuating dress","Red, One-piece, Day-dress, Knee-length, Waist-accentuated, Smile-design, Sleeve, Orange",E2551_Red_1.png
E2210,Silver,"This stunning silver dress exemplifies chic elegance. Perfect for special occasions, the dress captivates with its flattering silhouette, featuring intricate details from neck to hem, complemented by matching silver shoes.","A dazzling silver dress with matching shoes, offering sublime elegance for a striking ensemble.","Silver dress, elegant dress, special occasion outfit, flattering silhouette, matching silver shoes, flashy dress, chic fashion.","Silver, Dress, Shoes, Elegance, Chic, SpecialOccasion.",E2210_Silver_1.png
E2328,Black,"This is a sleek, black one-piece dress that beautifully contours to your body. It features a flattering neckline, elegant sleeves, and is cinched at the waist. The length of the dress reaches the knee with a daring thigh-high gesture. Best suited for day events, the dress is photogenic under flash photography.","Chic black one-piece day dress, knee-length, with striking neckline and elegant waist cinching.","Black dress, one-piece dress, flattering neckline, Waist-cinched, Day dress, Knee-length, Flash photography friendly, women's fashion, daywear, chic dress.","Black, One-piece, Dress, Neckline, Sleeve, Waist, Day-dress, Knee-length.",E2328_Black_1.png
E2593,Navy,"This is a chic navy one-piece day dress. It's perfect for any occasion, featuring a flattering neck design and shoulder showcasing cut. Its outerwear attributes ensure a warm, comfortable fit, which is bound to bring a smile to your face.","A stylish navy day dress, showcasing an elegant neck and shoulder design. ","Navy day dress, One-piece dress, Comfortable outerwear, Elegant shoulder design, Flattering Neckline, Chic Dress, Warm dress.","Navy, One-piece, Outerwear, Shoulder-showcase, Elegant, Comfortable.",E2593_Navy_1.png
B8588,Skyblue,"This stunning sky-blue dress is a statement piece. It features a collar, cinches at the waist, and extends till the knee. The one-piece garment elegantly folds at the arms, enhancing the beautiful gesture of the dress.","Effortlessly chic sky-blue knee-length dress. Flattering cinched waist and stylish collar, perfect for daywear.","Sky blue dress, One-piece dress, Day dress, Knee-length dress, Dress with collar, Dress with sleeves, Waist-cinching dress","Skyblue, Dress, One-piece, Daywear, Knee-length, Collared, Sleeved, Waist-cinched",B8588_Skyblue_1.png
E2324,Pink,"This is an enchantingly beautiful pink one-piece wedding dress. The dress, designed to accentuate the bride's hair, arm, and legs, personifies elegance and charm. It’s a perfect blend of sophistication and romance.","Radiate sophistication with a touch of whimsy in our alluring pink bridal gown, glorifying feminine aesthetics.","Pink wedding dress, one-piece dress, bridal clothing, bridal party dress, arm-revealing dress, leg-enhancing dress, wedding gown","Pink, One-piece, Wedding, Dress, Bridal, Party, Arm-revealing, Leg-enhancing",E2324_Pink_1.png
E2517,Champagne,"This is an enchanting champagne-colored dress, perfect for all your special events. It's a one-piece garment designed with a stylish shoulder detail complemented by a chic sleeve. The effortlessly elegant foot-length outfit will flatter your silhouette while the graceful dress color will leave an unforgettable impression. ","An elegant champagne one-piece dress with stylish shoulder and sleeve details, perfect for special occasions. ","Champagne dress, one-piece dress, elegant dress, special occasion dress, shoulder detail dress, foot length dress, sleeve detail dress.","Champagne, Dress, One-piece, Shoulder-Detail, Sleeve-Detail, Foot-Length, Elegant, Special-Occasion.",E2517_Champagne_1.png
E2773,Light-Gold,"Delightfully lustrous in a Light-Gold shade, this dress highlights alluring joint & shoulder seams with a fitted waist. Its design embraces the thigh while its long sleeves and tasteful neckline add elegance. What truly stands out is the automotive design inspiration reflected subtly, making it a real statement piece. The details, from smily lips to fluttery eyelashes, add a playful touch. ","Light-Gold dress with body-contouring cut, automotive design inspiration & playful detail, embodies effortless elegance and standout style.","Light-Gold dress, fitted waist dress, long sleeve dress, playful detail, automotive design-inspired dress.","Light-Gold, Long-sleeve, Fitted-Waist, Automotive-Design, Playful-Detail",E2773_Light-Gold_1.png
E1940,Gunmetal,"This chic, one-piece day dress draws attention to your unique persona. It sports a smart gunmetal color, accentuating the shoulder and neck areas. It features a comfortable waist, an elongated arm sleeve, and an expressive gesture for a touch of style.","A gunmetal day dress with a focus on the arm, shoulder, and neck. Comfortable waist, expressive gesture, and chic look.","Gunmetal day dress, one-piece dress, stylish waist, long sleeve, outerwear, unique gesture design, comfortable neck and shoulder design.","Clothing, Outerwear, One-piece, Arm, Shoulder, Neck, Day Dress, Sleeve, Waist, Gesture, Gunmetal.",E1940_Gunmetal_1.png
E1579,White,"This captivating white wedding dress is the epitome of elegance and sophistication. An enchanting strapless design complements the dress's graceful silhouette. The gown's fine embellishments add a touch of glamour, while the cinched waist ensures a flattering fit. Perfect for a wedding or bridal party.","Exquisite strapless white dress, perfect for bridal wear, adorned with tasteful embellishments and beautifully cinched waistline.","Strapless wedding dress, white bridal dress, bridal party dress, wedding gown with embellishments, daytime wedding dress, fitted waist dress.","White, Strapless, Wedding, Bridal, Embellished, Waist-fit, Gown.",E1579_White_1.png
E2243,Black-Red,"This beautiful One-piece Black-Red Dress adds a fashionable twist to your wardrobe. Designed for elegance, its haute couture inspired silhouette accentuates the figure. The distinctive arm coverage, elevated neckline and flattering leg display makes it perfect for a chic day look. ","Elegant Black-Red Dress with stylish arm design, comfortable neckline, and a luxurious look that flatters every figure.","Black-Red Dress, One-piece garment, Hairstyle dress, Day dress, Elegant dress, Chic wear, Arm design dress.","Black, Red, One-piece, Hairstyle, Arm, Shoulder, Dress, Leg, Day-dress, Neck, Sleeve.",E2243_Black-Red_1.png
E1421,Coral,"This elegant coral dress boasts a rich intimacy with its one-piece design that highlights the shoulder, arm, and waist. An exquisite day dress, it perfectly fits for casual and formal gatherings alike with its beautiful gown-like sleeve profile and flattering neckline. ","An epitome of charm, this coral one-piece dress whispers elegance, strikingly enhancing the natural silhouette.","Coral dress, One-piece dress, Day dress, Casual gown, Elegance, Shoulder showcase, Waist-highlighting, Neck flattery, Sleeve design.","Coral, One-piece, Daydress, Casual, Formal, Elegant, Shoulder-revealing, Waist-defined, Neckline, Sleeve.",E1421_Coral_1.png
