Code,Color,Long Description,Short Description,Keywords,Tags,Filename
E2754,Navy,"This is an exquisite navy one-piece dress that embodies a perfect blend of fashion and comfort. It flatters the human body with its focus on the waist, neck, shoulder, and arm. Its color, a deep vibrant azure, increases the overall allure.","Radiant navy dress accentuating shoulders and waist - brings out elegance for a chic, modern look.","Navy dress, one-piece garment, fashion-forward, body-focused, waist-emphasized, neck accentuated, shoulder-focused, azure shade dress.","Navy, One-piece, Dress, Azure, Fashion, Neck, Waist, Shoulder, Arm.",E2754_Navy_1.png
E2769,Royal,"This elegant Royal Azure dress is a one-piece garment that exhibits a fusion of comfort and style. Highlighting a sophisticated shoulder and neck design, it mirrors the latest fashion trends while emphasizing on the human body structure. It's a perfect representation of a blend between chic and comfort.","Royal Azure dress with a sleek shoulder and neck design, embodying high fashion with comfort.","Royal Blue Dress, One-Piece Dress, Azure Outfit, Fashionable Apparel, Comfortable Clothing, Stylish Dress, Neckline Dress ","Royal, One-piece, Shoulder, Dress, Azure, Fashion, Comfort",E2769_Royal_1.png
E1546,Purple,"This is a stunning purple dress designed for fashion-forward individuals. It is a day dress that showcases nods to a timeless style, beautifully crafted with an elegant one-piece garment cut. It highlights the human body's shape and pairs well with various footwear choices. The dress accents the arm, shoulder, and leg, and adds a dash of glamour to an everyday look. ","Elegant purple day dress showcasing unique elegance, meticulously crafted to flatter any physique. ","Purple day dress, One-piece garment, Dress for all occasions, Universal footwear pair, Elegant fashion dress, Dress flattering to body, Hair-friendly dress","Purple, One-piece, Day-dress, Elegant, Universal footwear pair, Body flattering, Hair-friendly",E1546_Purple_1.png
E2072,Black,"This fashionable black day dress offers a daring and stylish look. As a one-piece garment with a focus on futuristic fashion design, it beautifully accentuates the waist, while its elongated sleeves provide a unique touch of elegance. The slightly high neck adds a sophisticated finish, making it perfect for any occasion.","Black, day-dress featuring unique sleeve design and high-neck. Perfect mixture of style, class, and modern fashion.","Black dress, day dress, outerwear, one-piece, high-neck, long sleeves, elegant, modern fashion design, waist-accentuating, stylish gesture ","Black, Dress, Day-dress, Sleeve, Waist, High-neck, One-piece, Outerwear, Fashion-design, Gesture",E2072_Black_1.png
E2329,Black,"This elegant black one-piece day dress features a graceful neck, waist and sleeve design. With fashion-forward embellishments and a sublime fit, the dress exemplifies high-end formal fashion, suitable for a variety of occasions. The model with black hair enhances the aesthetic.","An elegant black day dress with fashion embellishments, ideal for formal occasions.","Black day dress, Formal dress, Fashion embellishments, One-piece garments, High-end fashion","Black, Dress, Formal, One-piece, Day-dress, Embellishment, Fashion",E2329_Black_1.png
E2110,Black,"This is a chic, sleek black sheath dress - a one-piece garment perfect for any occasion. The garment elegantly accentuates the waist and neck, featuring chic sleeve details and sophisticated embellishments that add a unique charm. It's an ideal day-to-night dress. ","On-trend black sheath dress with waist and neck accents, stylish sleeves, and exquisite embellishments. Day-to-evening elegance.","Black sheath dress, One-piece dress, Elegant day dress, Accentuated waist, Neck detail dress, Embellished dress, Chic outerwear, Stylish sleeves","Black, Sheath, One-piece, Outerwear, Day dress, Neck, Waist, Sleeve, Gesture, Embellishment",E2110_Black_1.jpg
E2267,Royal-Blue,"This stunning royal-blue one-piece garment merges style and comfort effortlessly. The dress, designed with an eye-catching azure tone, features a defined waist, a modest neckline, and a versatile day dress length. The dress inspires with its shoulder and leg-exposing design, making it a perfect fit for an elegant look on any special occasion.","Eye-catching royal-blue one-piece dress with defined waist, flattering neckline, and an elegantly bold shoulder and leg-exposing design.","Royal-blue dress, One-piece garment, Azure day dress, defined waist dress, leg exposure dress, shoulder exposure dress, Purple accessory outfit. ","Royal-Blue, One-Piece, Azure, Day-Dress, Waist-defined, Leg-exposing, Shoulder-exposing.",E2267_Royal-Blue_1.jpg
E1923,Navy,"This is an exquisitely crafted navy one-piece dress that accentuates your waist and neckline. It comes with a sleeve that envelopes right past your shoulder and ends mid-thigh, perfect for casual or semi-formal occasions. ","Beautifully tailored, navy blue dress, with distinctive waist and neckline emphasis. Charmingly elegant for all occasions.","Navy dress, One-piece, Waist accentuating, Sleeve dress, Mid-thigh length, Semi-formal dress, Casual dress, Dress with neckline","Navy, One-piece, Waist, Sleeve, Mid-thigh, Semi-formal, Casual, Neckline",E1923_Navy_1.jpg
AA9331,White-Ivory,"This stunning wedding dress, hosted under the color palette of white-ivory, mesmerizes with its artful design. It presents an enchanting bridal charm perfect for the wedding ceremony held in a temple or other holy settings. The beautifully tailored waist gracefully stages the happy bride, while the gown flows elegantly for a perfect bridal party.",Enchanting white-ivory wedding dress. Incredibly Tailored waist highlights joyous bride. Gown ensures elegant bridal party appearance.,"Bridal Gown, White-Ivory Dress, Wedding Dress, Bridal Ware, Bridal Party Dress, Temple Wedding Dress, Elegant Gown, Waist Highlighting Dress","White-Ivory, Wedding, Bridal, Bride, Dress, Gown, Waist, Happy, Temple, Party",AA9331_White-Ivory_1.png
E1260,Truffle,"This is a stunning, one-piece truffle dress showcasing an alluring day dress style. Its design offers an exquisite blend of sophistication and comfort. The dress features an extended shoulder and arm coverage, extending down to the joint. The dress's neck outline gracefully complements the human body shape, making it perfect for any occasion.",Elegant truffle-colored one-piece day dress with shoulder coverage and a flattering neckline. Perfect for every day elegance.,"Truffle dress, One-piece day dress, Elegant dress with shoulder coverage, Dress with flattering neckline, Sophisticated outerwear.","Truffle, One-piece, Day-dress, Outerwear, Elegant, Shoulder-coverage, Neckline.",E1260_Truffle_1.png
E2785,Gold,"This captivating gold gown is a one-piece garment designed to accentuate the waist. It features a sophisticated neck styling, elegantly dressed shoulders and displays a simple yet refined silhouette. The dress embodies fashion-forward design and promises a stunning look perfect for any occasion.","Sleek gold gown, accentuated waist, sophisticated neck design, elegant shoulder dressing, promising a flattering silhouette.","Gold Gown, Waist-accentuating dress, One-piece outfit, Fashion-forward design, Elegant shoulder dress, Sophisticated neck dress","Gold, Gown, Waist, One-piece, Neck, Sleeve, Shoulder, Dress, Design, Model",E2785_Gold_1.png
E2346,Gold,"This stunning gold dress is the epitome of elegance and glamour. It features intricate embellishments that shimmer beautifully, cascading down the one-piece garment. The dress boasts an off-the-shoulder design with a unique neckline, perfect for showcasing your chosen accessories. It is the optimal fit for wedding ceremonies or special events.","Gold, off-shoulder gown adorned with breathtaking embellishments, perfect for weddings and grand celebrations.","Gold Dress, Wedding Gown, Embellished Dress, One-piece garment, Off-shoulder gown, Elegant dress, Gold wedding dress.","Gold, Wedding, Embellishment, One-piece, Off-shoulder, Dress, Elegant.",E2346_Gold_1.png
AA9319,White-Ivory,"Celebrate your special day in a radiant white-ivory wedding dress. This one-piece garment generously adorned with intricate details elegantly hugs the waist. Experience the charm of a bridal party dress with a delicate hint of nature, thanks to the subtle plant accents and bridal clothing, uniquely designed for the radiant bride.","Radiant white-ivory bridal dress, adorned with intricate details and subtle plant elements, redefining bridal elegance.","White-ivory wedding dress, bridal party dress, one-piece bridal garment, bride, waist-accentuating dress, plant details, flash photography.","White-Ivory, Wedding, Dress, One-piece, Bridal, Waist,, Plant-detail, Flash-photography.",AA9319_White-Ivory_1.png
E2162,Rainbow,"Modern design meets the eye-catching colors of the rainbow in this one-piece day dress. This multi-colored dress features a unique blend of vibrant hues, complemented by its casual outerwear look. Perfect for flaunting your style on a fun-filled day out.","Vibrantly hued rainbow day dress, perfect blend of casual-yet-stylish outerwear.","Rainbow dress, One-piece garment, Day dress, Outerwear, Colorful clothing, Casual wear, Vibrant dress.","Rainbow, One-piece, Day-dress, Outerwear, Colorful, Casual",E2162_Rainbow_1.png
B8998,Royal,"A quintessential dress in Royal color that boasts an exquisite day dress design. The garment is expertly tailored to fit the human body, accentuated by a one-piece structure. Detailing includes a bridal party dress touch, coupled with visible arm and hand aspects, all under a delightful umbrella of a purple hint.","Royal purple one-piece day dress, elegantly tailored with bridal accents for timeless beauty.","Royal Dress, Purple One-Piece, Day Dress, Bridal Party Dress, Tailored Garment, Human Body Fit.","Royal, One-Piece, Human-Body, Day-Dress, Bridal-Party-Dress, Purple.",B8998_Royal_1.png
E2281,Purple,"This vibrant purple dress guarantees to turn heads with its strapless design and elegant day dress style. Perfectly hugging the human body, it features a comfortable one-piece structure that enhances the wearer's smile, hair, eye, and leg details.","Strapless, enchanting purple day dress. Body-hugging comfort meets chic, head-turning elegance. ","Purple Dress, Strapless Dress, Day Dress, One-piece Dress, Eye Catching, Body-hugging, Elegant, Comfortable ","Purple, Strapless, One-piece, Day-Dress, Comfortable, Elegant",E2281_Purple_1.png
E1336,Purple,"Wrap yourself in the embodiment of royalty with this purple one-piece strapless dress. The minimalist design takes center stage, delicately highlighting your shoulders, hair, and smile. A perfect blend of elegance and audacity.","Radiate effortless sophistication in this strapless, purple wonder. Flaunts your lovely smile, graceful shoulder and expressive hand.","Strapless dress, Purple dress, Minimalistic dress, Elegant dress, One-piece garment, Shoulder-revealing, Smile enhancement","Purple, Strapless, One-piece, Garment, Smile, Shoulder, Hand, Dress, Elegance",E1336_Purple_1.png
E2549,Black Green,"Showcasing a stunning black green one-piece garment, this day dress features an attractive joint at the shoulder. Exceptionally cut to highlight the waist and reach just to the thigh, it incorporates flash photography essence with a focus on the neck and sleeved design.","Timeless black-green day dress, shoulder joint detail, flash photography inspiration, waist-accentuating and thigh-length.","Black green day dress, joint shoulder dress, flash photography dress, waist-highlighting dress, thigh-length dress, sleeve dress, neck focus dress","Black, Green, One-piece, Day-dress, Shoulder-joint, Thigh-length, Sleeve, Neck, Waist.",E2549_Black Green_1.png
E2074,Midnight,"This elegant one-piece dress in a striking midnight color comes with a delicately designed neck. The garment emphasizes the wearer's waist, while the sleeve adds a modest, classy touch. This daylight-friendly dress smoothly covers the entire body, offering comfort with style.","Elegant midnight dress with a waist-focused fit, modest sleeves, and a sleek one-piece design for daytime wear.","Elegant dress, Midnight color dress, One-piece dress, Day dress, Dress with sleeves, Waist-highlighting dress.","Midnight, Dress, One-piece, Daywear, Sleeves, Waist-focused.",E2074_Midnight_1.jpg
E1071,Truffle,"This elegant one-piece truffle colored dress features a flatteringly cinched waist, a strapless neck design and a thigh-high cut. The dress's daywear adaptability is enhanced by flash photography and is perfect for every occasion to make a fashionable statement.","Chic truffle strapless dress. Features a cinched waist, thigh-high cut, perfect for a day date or night out.","Elegant one-piece dress, Truffle color dress, Cinched waist dress, Strapless dress, Thigh-high cut dress, Flash photography dress, Day dress.","Truffle, One-Piece, Waist, Dress, Strapless, Thigh-High, Day-Dress, Flash-Photography.",E1071_Truffle_1.jpg
E2213,Navy,"This is a sleek sheath dress in a sophisticated navy color, perfect for any occasion. It reaches the knee, subtly showcasing the legs and arms. With a comfortable round neck design, it is a one-piece garment that embodies high fashion and elegance.",Chic navy sheath dress - flaunt your style with sophistication; an ultimate fashion attire.,"Navy sheath dress, elegant day dress, one-piece garment, fashionable dress, knee-length dress, dress for all occasions.","Navy, Sheath, Dress, Elegant, One-Piece, Knee-Length, Fashionable.",E2213_Navy_1.jpg
E2096,White-Black,"This elegant one-piece garment is a beautifully designed day dress, featuring a charming contrast of white and black. Its careful construction accentuates the waist, flowing gently down to a perfectly tailored hem. The dress's sleeves gently graze the arm, adding a touch of delicacy. The neckline draws attention to the wearer's shoulders and neck, creating a silhouette that exudes sophistication and style.","Stylish white-black mix one-piece day dress, gracefully highlighting the waist, neck, and shoulders. Perfectly tailored for an elegant look. ","White-Black Day Dress, One-Piece Garment, Elegant Dress, Waist Highlighting Dress, Stylish Day Dress, Contrast Dress, Sleeve Dress, Neckline Dress, Shoulder Detail Dress","white, black, one-piece, day-dress, elegant, stylish, waist, neckline, shoulder, sleeve",E2096_White-Black_1.jpg
E1774,PowderBlue,"Encompassing a delicate shade of powder blue, this one-piece dress serves as the epitome of stylishness. This azure beauty features chic outerwear and a joint design around the waist that follows the sleek silhouette of your shoulders, thereby accentuating your elegance. Surrounded by hints of purple and green, it results in a sublime blend of sophistication and charm. ","Stylish powder blue one-piece dress paired with chic outerwear, perfectly highlighting feminine elegance in azure, purple and green hues.","Powder blue dress, one piece dress, stylish outerwear, joint design, shoulder showcasing, feminine elegance, hints of purple and green","PowderBlue, One-Piece, Outerwear, ShoulderShowcasing, Azure, Purple, Green",E1774_PowderBlue_1.png
E1421,Royal,"This dress from our collection is an elegant royal blue one-piece garment. Crafted with a flattering silhouette, it reveals subtle hints of the wearer's shoulder, arm, and leg. Ideal for daytime wear, this dress combines style with comfort effortlessly.","Royal blue one-piece, exhibiting grace of human body. Ideal for day dress - an epitome of comfort and chic.","Blue dress, one-piece dress, daytime wear, comfortable dress, royal blue, elegant dress, shoulder reveal dress, arm reveal dress","Blue, One-piece, Day-dress, Comfortable, Elegant, Shoulder-reveal, Arm-reveal, Royal.",E1421_Royal_1.png
E2053,Teal,"This radiant teal one-piece day dress is a masterstroke of fashion design. It beautifully highlights the waist and arms while the dress graces the shoulders and neck in an elegant fashion. The gown also features an expertly designed sleeve, perfect for any occasion.","Striking teal day dress, elegantly designed to accentuate the waist, shoulders and neck, perfect for any fashion-forward look.","Teal gown, One-piece dress, Day dress, Fashionable dress, Elegantly designed, Shoulder dress, Arm dress, Dress for waist, Sleeve dress, Neck dress.","Teal, One-Piece, Day-Dress, Waist, Sleeve, Neck, Shoulder, Gown, Fashion",E2053_Teal_1.png
E2171,Sky-Blue,"This elegant Sky-Blue dress is sculpted to enhance the female form. Designed with a sophisticated one-piece construction, it graces from shoulder to leg, adorned with eye-catching detail. The garment is soft on the skin, making it a flawless mix of comfort and style.","Enchantingly sky-blue, this one-piece displays elegance from shoulder to leg; the perfect blend of comfort and chic.","Sky-blue dress, one-piece dress, comfortable dress, elegant dress, stylish dress, shoulder to leg dress, soft fabric dress, eye-catching dress","Sky-blue, One-piece, Shoulder-length, Stylish, Comfortable, Elegant",E2171_Sky-Blue_1.png
E2258,Charcoal,"This beautiful charcoal-colored sheath dress is ideal for any occasion. Fitting closely at the waist, it effortlessly accentuates your curves. It comes in a one-piece design, with an elegant neck and a leg-revealing length. Enjoy the comfort of its fabric and show off a dazzling smile as you wear it.","Effortlessly chic, charcoal sheath dress with a fine cut, perfect for enhancing curves and creating tasteful allure.","Charcoal sheath dress, one-piece dress, leg-revealing dress, dress with neck, smile-enhancing dress.","Charcoal, Sheath, One-piece, Neck, Smile, Legs.",E2258_Charcoal_1.png
E2027,Wine,"This elegant one-piece dress in a stunning wine color features a flattering bridal party design. It showcases an attractive waist and is knee-length, with beautiful sleeves that accentuate the neck line. The design is perfected with an exceptional fashion touch, accommodating both day and formal wear. ","Elegant wine one-piece dress with a radiant bridal-party design, flaunts a fashionable waist and neckline. ","Wine one-piece dress, Bridal party dress, Fashionable waist and neck, Day-wear dress, Knee-length dress","Wine, One-piece, Bridal, Waist, Neck, Day-wear, Knee-length",E2027_Wine_1.png
E1796,Biscotti,"A refined Biscotti-colored dress featuring an elegant one-piece silhouette. The detailing around the shoulders and neck enhances the overall appeal. With grey undertones, this piece not only suits formal occasions like bridal parties but also works well as a chic day dress. It cinches at the waist, enhancing the feminine form, with a sleeve length that complements the overall design.","Chic Biscotti one-piece dress with sophisticated neckline, shoulder details, waist cinching feature, ideal for bridal parties, or as a day dress.","Biscotti dress, Day dress, Bridal party dress, One-piece garment, Shoulder detail dress, Waist-accentuating dress, Elegant neck dress.","Biscotti, One-piece, Formal, Day-Dress, Bridal, Shoulder-detail, Waist-accentuating, Neck-details.",E1796_Biscotti_1.png
E2437,Navy-Print,"This charming navy print day dress features a bold outerwear-inspired design. With a focus on the arm, shoulder, and waist, it boasts a trendy one-piece motif and flattering neckline. The standout print and stylish sleeve length make it a versatile pick.","Sleek navy day dress with outerwear-inspired detail, flattering neckline and waist design for trendy elegance.","Navy print dress, Day dress, Outerwear-style dress, One-piece, Flattering neckline, Stylish sleeve","Navy, Print, Day-dress, One-piece, Outerwear-style, Waist-detail, Flattering-neckline, Stylish-sleeve",E2437_Navy-Print_1.jpg
E1379,Truffle,"A chic truffle-colored day dress, this garment wraps elegantly around the waist, extending to the thigh, designed with a flattering neckline and sleeves. The dress is modeled on a fashion runway highlighting its sleek, one-piece construction.","A timeless truffle day dress, sculpting the waist, accentuating the thigh with sleek sleeves, showcased by a model.","Truffle day dress, elegant waist fitting, thigh length dress, fashion model dress, chic one-piece dress.","Truffle, Day-dress, Waist-fit, Thigh-length, One-piece.",E1379_Truffle_1.png
E1275,Darklilac,"This Darklilac dress is a mesmerizing one-piece garment that effortlessly hugs the body. Its unique design highlights the shoulder and arm areas, ideal for showing off your skin. Its color gives a rich, regal impression, coupled with a joyful smile—it's the perfect ensemble for any event. ","Darklilac hued, body accentuating one-piece, adorned to bring out the elegance for every joyous occasion. ","Darklilac dress, one-piece garment, shoulder revealing dress, arm highlighting dress, event dress","Darklilac, One-piece, Shoulder-revealing, Arm-highlighting, Event-dress",E1275_Darklilac_1.png
E1774,Blush,"This blush-colored, one-piece wedding dress is an exquisite piece perfect for an unforgettable occasion. It features delicate fabric that fall to gracefully highlight the wearer's silhouette, paired with a beautiful outerwear overlay. The arm is subtly revealed, while the leg peeps through evocatively.","Stunning blush wedding dress, one-piece elegance with a lovely outerwear overlay, subtly revealing arm, and leg.","Blush wedding dress, Elegant one-piece, Outerwear overlay dress, Arm revealing wedding dress, Leg showing bridal gown.","Blush, One-piece, Wedding-dress, Outerwear, Arm-revealing, Leg-showing",E1774_Blush_1.png
AA9304,White-Ivory,"This stunning White-Ivory wedding dress, designed for the elegant bride, features an intricately tailored shoulder and neckline. The dress boasts a flattering waistline and sleeve detail, complemented by the subtle touch of plant motifs. It shines under flash photography, making it perfect for a photogenic bridal party.","Elegant ivory wedding dress with a beautifully tailored neckline & shoulder, adorned with plant motifs for a charming, photographic appeal.","White-Ivory wedding dress, Bride dress, Bridal clothing, Flash photography dress, Bridal party dress, Plant motif.","White, Ivory, Wedding-Dress, Bridal, Flash-Photography, Plant-Motif, Short-Sleeve, Bridal-Party.",AA9304_White-Ivory_1.png
E2068,Midnight,"Splurge in the epic elegance of this one-piece midnight purple day dress. Its voluminous sleeves and perfectly cinched waist complement the extended shoulder line. The apparels' outerwear quality gives it the perfect blend of casual and formal dress up, making it suitable for just about any occasion.","Midnight purple one-piece dress; voluminous sleeves, cinched waist, versatile for casual or formal look.","Midnight Purple Dress, Day Dress, One-Piece Dress, Outerwear, Voluminous Sleeves, Cinched Waist","Midnight, One-piece, Outerwear, Day-dress, Purple, Voluminous-sleeves, Cinched-waist",E2068_Midnight_1.png
E1319,White Black,"This is a chic, one-piece sheath dress in contrasting white and black colors. It features a modern, strapless design emphasized by an elegant shoulder detail. The dress is ideal for any occasion that demands sophistication accessorized with a statement hairstyle.","Chic strapless sheath dress in contrasting white-black colors, ideal for sophisticated events. Includes shoulder details and optimal for bold hairstyles.","strapless dress, black and white dress, one-piece garment, sheath dress, event dress, modern dress, shoulder detail dress, dress with hairstyle, sophisticated dress","Sheath, Strapless, Dress, One-Piece, Black, White, Hairstyle, Shoulder-Detail, Sophisticated",E1319_White Black_1.jpg
E2344,Black-Nude,"This elegant black-nude dress features a figure-flattering waist, extended sleeves, and a sophisticated neckline. Its one-piece design boasts a chic day dress style, suitable for various occasions. A perfect blend of comfort and fashion, this dress will accentuate your overall look.","Chic black-nude day dress, accentuates the waist, with elegant extended sleeves and a sophisticated neckline.","Slender silhouette dress, Black nude day dress, Extended sleeve outfit, Waist-highlighting dress, Sophisticated neckline dress","Black, Nude, One-piece, Day Dress, Extended Sleeves, Waist-centric, Sophisticated Neckline, Standing, Figure-flattering",E2344_Black-Nude_1.png
E2070,Apricot,"This fashionable apricot one-piece dress boasts an exquisite design, detailing a sleek neck and waist cut, effortlessly blending elegance and trend. Delicately embellished, this gown styled day dress is perfect for formal wear and ensures a head-turning presence.","Chic apricot gown-styled day dress, blending tasteful embellishments with a striking waistline for a formal, fashionable look.","Apricot Dress, One-piece formal garment, Embellished Gown, Day Dress, Fashionable Sleeve Cut","Apricot, One-piece, Day-dress, Formal-wear, Embellished, Fashion-design",E2070_Apricot_1.jpg
E1422,Purple,"Immerse yourself in the regally chic appeal of this purple one-piece dress. Tailored to perfection, it features a flattering shoulder and arm design that enhances the human body structure. The vibrant purple hue emphasizes its elegance and makes it a classic must-have in your wardrobe.","Elegant purple one-piece dress—flattering fit, iconic modernity, and style melded in one ","Purple dress, Elegant one-piece, Shoulder design, Arm joint fit, Human body flattering, Purple garment, Chic clothing ","Purple, One-piece, Dress, Elegant, Chic, Flattering, Garment, Clothing, Modern",E1422_Purple_1.jpg
