Code,Color,Long Description,Short Description,Keywords,Tags,Filename
E2074,Midnight,"This dress is a sophisticated one-piece garment in a majestic midnight color. Designed to accentuate the body shape, it features an eloquent knee-length cut. The dress outlines the waist flawlessly, extends to cover the shoulder and arm with well-tailored sleeves, and graces the neck with a beautiful round neckline.","Midnight purple day dress, elegantly accentuating the body, round neck and full-sleeves for a sophisticated, stylish look.","Midnight purple dress, Full Sleeve dress, One-piece garment, Day wear dress, Waist defining dress, Round neck dress.","Midnight, Full-sleeve, One-piece, Day-dress, Waist-defining, Round-neck.",E2074_Midnight_1.jpg
E1071,Truffle,"This elegant, truffle-colored one-piece dress is a perfect melding of comfort and style. The strapless cut accentuates the décolletage, and its cinched waist flairs subtly out to a thigh-length hem. Captured with a flash, the design speaks of a considered gesture to contemporary fashion.","Truffle-colored dress, strapless, cinched waist, thigh-length. A modern, fashion-forward statement.","Truffle dress, One-piece dress, Strapless dress, Waist dress, Thigh-length dress, Day dress, Fashion dress, Neck dress, Sleeve","Truffle, one-piece, strapless, waist, thigh-length, dress, flex, fashion, sleeve, neck.",E1071_Truffle_1.jpg
E2213,Navy,"This elegant one-piece sheath dress in a charming Navy shade offers a significant style statement. Tailored to hug your body, it highlights the contour of your figure while offering comfort, making it ideal for any event - daytime or nighttime.","Navy sheath dress - an epitome of elegant fashion. Comfortable, figure-flattering, suitable for any occasion.","Navy dress, Sheath dress, One-piece dress, Elegant fashion, Comfortable dress, Figure-flattering dress, Daytime dress, Nighttime dress ","Navy, One-piece, Sheath, Dress, Fashion, Elegant, Comfortable, Daywear, Nightwear",E2213_Navy_1.jpg
E2096,White-Black,"This classic white-black dress graces any occasion with its elegantly fitted waist and one-piece design. It features a flattering day dress silhouette, accentuating the shoulder and neck area with its unique sleeve design. ","Classic white-black dress, highlighting slim waist, shoulder, and neck for a captivating day-look.","White-Black Dress, One-piece Dress, Day Dress, Fitted Waist Dress, Elegant Dress, Shoulder Exposure Dress","White, Black, One-piece, Day-Dress, Fitted-Waist, Shoulder-Exposure",E2096_White-Black_1.jpg
E1774,PowderBlue,"This exquisite powder blue dress is an embodiment of elegance. The one-piece garment is designed with emphasis on the shoulders and joints, highlighting your natural charm. The dress captures attention with its subtle color transition from blue to azure, accented with hints of purple and green. Made to compliment your grace, this outerwear is your ideal pick for any casual or formal event.","Captivating powder blue dress. Exudes elegance with highlighted shoulders and azure, purple, green accents.","Powder blue dress, one-piece garment, shoulder accent dress, azure green accent dress, formal outerwear.","PowderBlue, One-piece, Shoulder, Dress, Purple, Green, Blue, Azure, Outerwear, Formal.",E1774_PowderBlue_1.png
E1421,Royal,"This royal blue one-piece dress is designed for utter elegance and comfort. Exquisitely tailored, it features exposed shoulders and covers till the leg. Perfect for daytime styling, the dress exhibits a sophisticated charm in its simplicity.","Elegantly tailored royal blue one-piece for smart daytime attire, revealing a hint of shoulder.","One-piece dress, royal blue, day dress, shoulder-exposing, elegance, refined style, comfortable wear.","Clothing, One-piece, Dress, Blue, Shoulder, Royal, Daydress, Elegance, Comfort.",E1421_Royal_1.png
E2053,Teal,"This one-piece teal dress is exquisitely designed to flatter any figure. The dress extends down to the waist with a well-tailored gown, long sleeves, and an alluring neck design. It's perfect for any day event with its unique fashion design.","Teal one-piece gown with an elegant neck design and long sleeves, ideal for day events.","Teal Dress, One-Piece gown, Long Sleeve Dress, Day Dress, Fashion Dress, Teal Long Sleeve Gown","Dress, Gown, Teal, One-Piece, Long-Sleeve, Day-Dress, Fashion",E2053_Teal_1.png
E2171,Sky-Blue,"A stunning sky-blue dress that beautifully hugs every curve. This one-piece garment sports minimalist yet elegant design with an eye-catching shoulder reveal. Its superb fit enhances the skin, joint, hand, shoulder, arm, eye, and leg.","Lavishing sky-blue dress, radiates elegance with minimalist styling, showcasing beautiful shoulder detail.","Sky-Blue Dress, Elegant One-Piece, Shoulder Detail, Minimalist Style, Curve-Enhancing, Joint Highlighting Dress, Hand, Shoulder, Arm, Eye, Leg.","Sky-Blue, Dress, One-Piece, Elegant, Minimalist, Shoulder-Reveal, Curve-Enhancing.",E2171_Sky-Blue_1.png
E2258,Charcoal,"This is a stunning sheath dress designed purely in alluring charcoal color. The one-piece garment gently hugs the contours of the wearer's body, accentuating the human figure beautifully. Its chic silhouette, perfect for both day or night engagements, showcases the elegance of a woman's neck and legs. Complemented with the right pair of shoes and a winning smile, this dress makes the perfect style statement. ","A charcoal, form-fitting sheath dress exuding effortless elegance, perfect for any time of the day. ","Charcoal dress, Sheath dress, One-piece dress, Dress for day or night, Stylish dress, Elegant dress, Chic dress, Comfortable women's dress","Charcoal, Sheath, One-piece, Day-dress.",E2258_Charcoal_1.png
E2027,Wine,"An elegant wine-colored, one-piece day dress, perfect for a bridal party or a classy event. This fashion-forward dress features a high neck and flattering waistline, complimented by charming and tastefully designed sleeves. The length of the dress extends to the knee, revealing an appealing glimpse of the thigh and leg.","Elegant wine day dress, perfect for bridal parties. High neck, waist detail, knee-length, fashion-forward design.","Day dress, wine dress, one piece, bridal party dress, high neck dress, waist detail dress","Wine, One-piece, Day, Dress, Bridal, Neck, Sleeve, Waist, Thigh, Knee",E2027_Wine_1.png
E1796,Biscotti,"This one-piece Biscotti colored dress is designed to redefine elegance and style. Its structured shoulder design, defined waistline, and exquisite sleeve detail marks it as a perfect bridal party or day dress. The graceful neck adds a touch of sophistication, presenting a stunning example of simplistic yet alluring fashion.",Biscotti one-piece dress with elegant shoulder and waist design. Ideal for bridal parties and daytime celebrations.,"Biscotti dress, One-piece garment, Wedding party dress, Day dress, Dress with shoulder design, Dress with waist detail, Sophisticated neck dress, Grey dress","Biscotti, One-piece, Shoulder design, Dress, Neck design, Sleeve detail, Waist definition, Bridal party, Day dress, Grey",E1796_Biscotti_1.png
E2437,Navy-Print,"This Navy-Print day dress is a one-piece garment that hugs your waist while giving off a relaxed fit overall. It features a visually appealing Outerwear feel with long sleeves that delicately cover the arms and shoulders. Neckline to hem, this dress exudes a cool, modern hairstyle print that adds an innovative touch, enhancing any look instantly. Ideal for any day event, effortlessly fusing style with comfort. ","Navy-Print Day dress. Exquisite modern style with a flattering waistline, long sleeves, and innovative printed design. Perfectly stylish and comfortable.","Navy Print Day dress, One-piece outerwear, Hairstyle print dress, Long sleeve dress, Comfortable day dress, Waist-flattering dress, Modern style dress, Unique print dress","Navy, Day-dress, Long-sleeves, One-piece, Outerwear, Waist-flattering, Modern, Comfort, Unique-print",E2437_Navy-Print_1.jpg
E1379,Truffle,"A fashionable truffle-colored dress, featuring a flattering waistline, elegant sleeves, and a stylish one-piece design. The garment gently fits around the neck and extends down to the thigh. Showcased by a fashion model, this day dress is perfect for a sophisticated look.","Sophisticated, truffle-colored day dress with elegant sleeves, flattering waistline, extending to thigh-length.","Truffle dress, one-piece garment, day dress, elegant sleeves, flattering waist, thigh-length dress, fashion model dress.","Truffle, One-piece, Day-dress, Sleeves, Waist, Thigh-length, Fashion-model.",E1379_Truffle_1.png
E1275,Darklilac,"This Darklilac dress wraps the body in a silhouette that gracefully highlights the shoulders and arms. Tailored from soft, high-quality fabric, it is designed to enhance your natural beauty yet maintain an effortless elegance. Its one-piece design makes it the essence of simplicity yet trendiness with a thoughtful nod to comfort and fit.","Darklilac dress with a playfully graceful silhouette for an effortless, elegant godsend.","Darklilac dress, One-piece dress, Elegant dress, comfortable fit, shoulder highlighting, arm enhancing","Darklilac, One-piece, Comfortable, Elegance, Shoulder, Arm, Smile",E1275_Darklilac_1.png
E1774,Blush,"This stunning blush wedding dress is the epitome of elegance. The one-piece garment is beautifully designed to accentuate your figure, featuring exquisite outerwear details. With attention to arm and leg exposure, it's complemented by an elaborately crafted hair accessory.","Classically elegant blush wedding dress with a sculptured fit, accessorized with an extravagant hair piece.","Blush Wedding Dress, Elegant Bridal Wear, Hair Accessory, One-piece Bridal Gown, Elegant Outerwear","Blush, Wedding-dress, One-piece, Elegance, Outerwear, Hair-piece",E1774_Blush_1.png
AA9304,White-Ivory,"This elegant white-ivory wedding dress makes every bride's dreams come true. Designed with exquisite shoulder work, a striking neckline, and a sophisticated waist, the dress features a beautiful bridal party silhouette. Intertwining flash photography and subtle plant motifs enhance the overall allure, making it a perfect bridal ensemble.","Enchanting white-ivory wedding gown with sophisticated shoulder design, striking neckline, and exquisite waist detail enhanced with plant motifs.","White-Ivory Wedding Dress, Bridal Party Dress, Wedding Gown with Plant Motifs, Bridal Gown with Shoulder Detail, Wedding Dress with a Striking Neckline.","White, Ivory, Wedding Dress, Shoulder Detail, Bride, Bridal Clothing, Neck Detail, Flash Photography, Plant Motif, Bridal Party Dress, Sleeve Detail, Waist Design.",AA9304_White-Ivory_1.png
E2068,Midnight,"This exquisite midnight-colored day dress is specifically designed as a one-piece outerwear. Its features include flattering shoulder to waist cuts, a graceful neck, and bespoke sleeves that bring elegance and sophistication.","A symbol of classic elegance, this one-piece, midnight-colored day dress celebrates the beauty of distinctive simplicity.","Midnight Day Dress, One-Piece Clothing, Purple Day Dress, Outerwear, Chic Neck Design, Sleeve Detail, Waist Flattering","Midnight, One-Piece, Outerwear, Dress, Purple, Sleeve, Waist",E2068_Midnight_1.png
E1319,White Black,"Featuring a beautiful blend of black and white, this excellently designed one-piece sheath dress is a picture of elegance. The fabric gracefully hugs the figure, accentuating the shoulders and joints. It's the perfect outfit for evening parties and formal events. The strapless design adds a dash of audacity to this timeless classic. ","Strapless monochrome sheath dress, refined elegance, the ideal ensemble for a head-turning event look.","Strapless, Sheath Dress, One-piece, Black and white, Evening Wear, Formal Attire, Elegance, Classy, Flashy, Black Dress, White, Party Outfit.","Black, White, Strapless, Sheath, One-Piece, Formal, Evening, Party, Dress.",E1319_White Black_1.jpg
E2344,Black-Nude,"This elegant dress in black-nude color, features a fitted waist and a classic day dress design. The one-piece garment enhances the shoulder and neck area while the elegant waist and sleeve design accentuates the body's curves. Perfect for day-to-day wear or special occasions.","Chic black-nude day dress, highlighting shoulders and waist, perfect for everyday elegance or special occasions.","Black-nude dress, one-piece dress, shoulder accentuating dress, day dress, elegant dress, fitted waist dress, dress","Black, Nude, Onepiece, Day-Dress, Shoulder, Waist, Sleeve, Standing",E2344_Black-Nude_1.png
E2070,Apricot,Embrace fashion-forward elegance with our lovely apricot gown. This one-piece day dress features a chic neckline and a cinched waist to flatter. Sophisticated embellishments add the perfect finishing touch to create a visually stunning formal wear.,"Luxurious apricot gown, gracefully cinched at the waist. Elegant neckline and exquisite embellishments. Day dress meets formal elegance.","Apricot gown, One-piece dress, Embellished dress, Formal day dress, Waist-cinched dress, Fashionable neckline dress.","Apricot, Gown, One-piece, Day-dress, Embellishments, Formal-wear.",E2070_Apricot_1.jpg
E1422,Purple,"Unleash your inner diva with this elegant purple, one-piece dress. Designed for comfort and style, it molds perfectly to your body, showcasing your shoulder and arm joints. The dress stops just at the neck, making it perfect to show off your hair.","Enchanting purple one-piece garment, flawlessly showcasing the human body in a stylish and comfortable manner.","Purple dress, One-piece garment, Comfortable clothing, Elegant dress, Hair showcasing outfit, Shoulder and neck dress, Joint-friendly dress.","Purple, One-piece, Comfortable, Dress, Elegant, Hair-showcasing, Shoulder-showing, Arm, Joint-friendly, Neck.",E1422_Purple_1.jpg
AA9256,White-Ivory,"This lavish White-Ivory Wedding Dress features a chic shoulder revealing cut. Perfect for brides who are looking for something traditional yet contemporary. The dress showcases beautiful bridal clothing with a hint of flash photography, giving an extra pop to the whole attire. The Strapless gown style adds elegance and a happy ambiance around the bride. ","Chic White-Ivory wedding dress. Traditional, contemporary, sparkling flash photography elements with strapless gown elegance.","White-Ivory Wedding dress, Bridal gown, Strapless bridal dress, Bridal party dress, Flash photography dress, Happy bride dress.","White, Ivory, Wedding, Dress, Bridal, Strapless, FlashPhotography, Gown, Happy",AA9256_White-Ivory_1.png
E2067,Black-Burgundy,"This alluring Joint One-piece dress comes in a striking Black-Burgundy dual-tone. The elegant day dress boasts a strapless design with a cinched waist that delicately highlights the silhouette. Featuring a thigh-high slit, it gives a glimpse of the leg while the sleek shoulder and sleeve add a touch of sophistication.",Chic Black-Burgundy strapless day dress with flattering waist and thigh-high split for a tantalizing hint of the leg.,"Strapless dress, Black-burgundy dress, Joint one-piece dress, Day dress, High slit dress, Cinched Waist Dress","Black, Burgundy, Strapless, One-Piece, Day-Dress, Thigh-High-Split, Cinched-Waist",E2067_Black-Burgundy_1.png
E1844,Mint,"This delightful mint dress is a one-piece stunner, featuring a strapless design that showcases the neck and arms. The day dress reaches up to the legs with a flowing cut that moves beautifully.","Summery mint strapless dress, showcasing bare neck and arms, with a flattering flowing cut to accentuate the legs. ","Mint dress, Strapless dress, One-Piece dress, Day Dress, Summer Garment, Flowing dress, Bare Neck Dress, Bare Arm Dress, Trendy Leg-flattering dress.","Mint, Strapless, One-piece, Day-Dress, Flowing, Summer, Bare-neck, Bare-arm, Flattering.",E1844_Mint_1.png
E2087,Rose-Quartz,"Unveil the elegance of rose quartz with this one-piece strapless dress. Featuring a fitted waist and billowing gown, it’s perfect for bridal parties. The thigh-high slit adds a touch of drama to the modest yet stylish sleeve design.",Rose quartz strapless dress; perfect fusion of sophistication and allure with a thigh-high slit and waist-accentuating design.,"Rose quartz dress, One-piece dress, Strapless dress, Bridal party dress, Gown with waist design, Thigh-high slit dress.","Rose-Quartz, One-Piece, Strapless, Bridal-Party, Waist-Design, Thigh-Slit.",E2087_Rose-Quartz_1.jpg
E1013,Sangria,"This one-piece Sangria colored dress is a feast for the eyes. It showcases enticing bare shoulders and arm, with a fitted waist that flares out into a day dress. The strapless design is complemented with a purple hue, emphasizing the neck and sleeve details. The dress resonates with daytime elegance, suitable for any chic casual events.","Sangria strapless day dress, featuring a fitted waist, bare shoulder design and detailed sleeve. Ideal for smart-casual events.","Purple Dress, Sangria Dress, Day Dress, Strapless Dress, One-piece Garment, Sleeve Detail, Fitted Waist","Purple, Strapless, Long, Sleeve Detail, Sangria, Waist, Day Dress",E1013_Sangria_1.png
E2255,Fuschia,"Show off your vibrant personality with this stunning fuschia one-piece garment. This day dress features a flattering waistline, a chic neckline, and showcases the arms and legs perfectly. Its outerwear quality makes it versatile for various occasions.","Vibrant fuschia one-piece, designed with a chic neckline and flattering waistline. Perfect for daytime sophistication.","Fuschia Dress, One-Piece Garment, Chic Day Dress, Purple Day Dress, Vibrant Outerwear, Flattering Waistline Dress","Fuschia, One-Piece, Day-Dress, Outerwear, Chic, Vibrant, Waistline, Purple",E2255_Fuschia_1.jpg
B8998,Sangria,"This stunning sangria purple dress features a strapless design with the day dress cut making it a fitting wear for garden parties or brunches. Its one-piece nature makes it easy to put on, and the hair on shoulder paired with a lively smile gives off a carefree and uplifting vibe.","Sangria purple strapless day dress perfect for summer outings - chic, spirited, and effortlessly stylish.","Sangria purple dress, Strapless dress, Day dress, one-piece dress, summer dress, party dress, brunch dress","Sangria, Purple, Dress, Strapless, One-piece, Day-dress, Summer, Party, Brunch",B8998_Sangria_1.png
E2331,Red,"This exquisite red gown is a stunning one-piece garment that elegantly drapes over the shoulder. Its fashion-forward design showcases a beautifully defined waist and a day dress style neckline. The dress also highlights a marvelous hairstyle, making it ideal for any formal event. ","A one-shouldered, red gown flaunting fashion design, defined waist, and dress-style neckline.","One-shoulder Red Gown, Day Dress, Waist-defining Gown, Fashionable Red Dress, Hairstyle Accentuating Dress","Red, One-Shoulder, Gown, Day-Dress, Waist-Defining, Fashionable",E2331_Red_1.png
E2136,Navy,"This is a beautiful one-piece day dress in a charming navy color. It showcases a generous arm and shoulder area, cinching at the waist for a flattering silhouette. The dress extends to the thigh, offering a balanced mix of modesty and allure. Embellished simply, it possesses a neat round neck with comfortable sleeves, making it a versatile option for various occasions.","Stunning navy one-piece day dress, flattering silhouette with a thigh-length finish for chic everyday elegance.","Navy day dress, one-piece dress, thigh-length dress, comfortable sleeves, round neck dress, flattering waist dress, versatile one-piece dress, simple dress, everyday dress, modest yet alluring dress.","Navy, One-piece, Day-dress, Thigh-length, Comfortable, Versatile, Simple.",E2136_Navy_1.jpg
E2101,Wine,"This elegant one-piece day dress in a rich wine color features a flattering waistline and graceful neckline. The dress provides ample arm and shoulder exposure, accentuated by the tastefully designed sleeves and joint detailing. Perfect for both formal and day outings.","Exquisite wine-colored day dress, highlighting the arm and shoulder silhouette elegantly, perfect for any occasion.","Wine-colored dress, Day dress, One-piece dress, Arm-exposing dress, Shoulder-exposing dress, Dress with joint detailing","Wine, One-piece, Adequate arm exposure, Ample shoulder exposure, Day dress, Joint detail",E2101_Wine_1.png
AA9330,White-Ivory,"This stunning White-Ivory wedding dress elegantly places emphasis on the bride's shoulders and neck with its refined cut. The dress features a classic bridal gown silhouette, accentuated by intricate detailing and a sophisticated hairstyle that completes the bridal look.","Timeless White-Ivory bridal gown, emphasizing shoulder and neck features; complete with a sophisticated bridal hairstyle.","White-Ivory Wedding Dress, Neckline Bridal Gown, Shoulder Accent Bridal Dress, Bridal Hairstyle, Sophisticated Wedding Gowns","White-Ivory, Dress, Bride, Wedding, Hairstyle, Shoulder-Detail, Neckline, Bridal, Gown",AA9330_White-Ivory_1.png
E2511,Blue,"An eye-catching azure blue one-piece dress. It smoothly wraps around your body and accentuates your silhouette. It has a classy v-neck and its lovely textile feels soft against the skin. Finished with a vibrant smile, you would look stunning in this dress.","Chic azure blue dress enhancing your individual style, offering comfort and elegance. ","Blue one-piece dress, azure dress, v-neck dress, soft textile dress, elegant blue dress.","Blue, One-piece, V-neck, Simple, Comfortable, Elegant, Azure.",E2511_Blue_1.png
E1544,Black,"This elegant black sheath dress is a versatile wardrobe staple, perfect for any time of the day. With its sleek body-contouring silhouette, the dress features a flattering waist and a modest neckline. The short sleeves add a sophisticated charm to the sublime one-piece garment.","Sleek black sheath dress, versatile elegance for day or evening, whispers of sophistication, flattering waist, subtle charm.","Black Sheath Dress, Day Dress, One-Piece Garment, Short Sleeve Dress, Sophisticated Dress, Elegant Dress, Modest Neckline Dress, Waist Flattering Dress.","Black, Sheath, Day-Dress, One-piece, Short-Sleeve, Elegant, Modest-Neckline, Waist-Flattering",E1544_Black_1.png
E2088,Wine,"This elegant wine-colored day dress is a one-piece garment designed for chic style. The dress has a tasteful, knee-length cut, accentuated by a sleek waist, with a graceful thigh length, enhanced with an impressive gesture design. It comes with a sophisticated arm and sleeve detailing, making it perfect for a day out.","Wine day dress; knee-length elegance with sleek waist design, chic arm and sleeves for a fashionable look.","Wine-colored dress, One-piece day dress, Fashionable arm details, Sophisticated sleeve design, Graceful knee-length, Sleek waist dress, Chic Thigh Length.","Wine, Day-dress, One-piece, Knee-length, Waist-design, Arm-detail, Sleeve-design.",E2088_Wine_1.png
E2075,Midnight,"This is an exquisite midnight-colored, day dress designed for the stylish woman. It features a sleek, one-piece construction that flatters the body, with an outerwear for added elegance. Hand-crafted details add a touch of sophistication to this versatile dress which can easily transition from day to night.","A sleek, midnight-colored dress, perfect for the modern woman. Brilliantly tailored with sophisticated hand-crafted touches.","Midnight dress, Day Dress, One-piece Dress, Sleek Dress, Hand-crafted Dress, Elegant Dress, Outerwear Dress, Modern Dress, Body-flattering Dress.","Midnight, Day-Dress, One-piece, Sleek, Hand-crafted, Elegant, Modern, Body-flattering.",E2075_Midnight_1.png
E2060,Midnight,"The E2060 is an elegant one-piece garment, tailored in a stunning midnight hue. Designed to flatter the figure, it narrows at the waist, creating a sophisticated silhouette. The face and neckline are accentuated, echoing the fashionable design. Its distinctive sleeve compliments the design, while also providing some coverage. The dress falls towards the thigh, adding a touch of boldness to the outfit. The wearer's black hair complements the midnight color, creating a harmonious and captivating look.","A chic midnight dress, accentuating the neckline, cinching at the waist, with a thigh-high finish. Perfect for black hair individuals.","Elegant midnight dress, One-piece fashion design, Accentuating neckline, Waist-cinching dress, Black hair complement, Thigh-high dress, Sleeve, Face.","Midnight, One-Piece, Waist, Sleeve, Thigh, Fashion, Neck, Face, Black Hair.",E2060_Midnight_1.png
E2498,Blue,"This elegant one-piece, strapless dress, dyed in an exquisite shade of blue, is designed to grace any event. The bridal party dress features a gentle neckline and a shoulder-exposing design, embellished with detailed craftsmanship that adds an extra touch of luxury. Its radiant flash photography captures the dress's allure, regardless of the occasion it is worn to. Although it is slotted as bridal clothing, this item is versatile enough to be worn at any formal gathering.","Radiant, blue strapless one-piece dress featuring a graceful neckline. Perfect for any formal event or bridal party. ","Blue Dress, Strapless Dress, One-Piece Garment, Formal Wear, Bridal Party Dress, Flash Photography Dress, Neckline Design Dress, Shoulder-exposing Dress.","Blue, One-piece, Bridal, Formal, Strapless, Shoulder-exposing, Neckline.",E2498_Blue_1.png
